#,título,nota_imdb,ano,duração,direção,gêneros,roteiro,elenco_principal,vencedor
276,E.T. the Extra-Terrestrial,7.9,1982,1h 55m,Steven Spielberg,"Aventura, Família, Ficção científica",Melissa Mathison,"Henry Thomas, Drew Barrymore, Peter Coyote, Dee Wallace, Robert MacNaughton",False
277,Gandhi,8.0,1982,3h 11m,Richard Attenborough,"Biografia, Drama, História",David Mamet,"Paul Newman, Charlotte Rampling, Jack Warden, James Mason, Milo O'Shea",False
278,Missing,7.7,1982,2h 2m,Costa-Gavras,"Biografia, Drama, História, Mistério, Suspense","Costa-Gavras, Donald E. Stewart","Jack Lemmon, Sissy Spacek, Charles Cioffi, Melvyn Douglas, John Shea",False
279,The Verdict,7.7,1982,2h 9m,Sidney Lumet,Drama,David Mamet,"Paul Newman, Charlotte Rampling, Jack Warden, James Mason, Milo O'Shea",False
280,Tootsie,7.4,1982,1h 56m,Sydney Pollack,"Comédia, Drama, Romance","Don McGuire, Larry Gelbart, Murray Schisgal","Dustin Hoffman, Jessica Lange, Teri Garr, Dabney Coleman, Charles Durning",False
281,Chariots of Fire,7.1,1981,2h 5m,Hugh Hudson,"Biografia, Drama, Esportes",Colin Welland,"Ben Cross, Ian Charleson, Nigel Havers, Alice Krige, Ian Holm",True
282,Reds,7.3,1981,3h 15m,Warren Beatty,"Biografia, Drama, História, Romance","Warren Beatty, Trevor Griffiths","Warren Beatty, Diane Keaton, Edward Herrmann, Jerzy Kosinski, Jack Nicholson",True
283,On Golden Pond,7.6,1981,1h 49m,Mark Rydell,Drama,Ernest Thompson,"Katharine Hepburn, Henry Fonda, Jane Fonda, Doug McKeon, Dabney Coleman",False
284,Raiders of the Lost Ark,8.4,1981,1h 55m,Steven Spielberg,"Aventura, Ação","Louis Malle, John Guare","Burt Lancaster, Susan Sarandon, Kate Reid, Al Waxman, Robert Joy",False
285,Ordinary People,7.7,1980,2h 4m,Robert Redford,Drama,Colin Welland,"Ben Cross, Ian Charleson, Nigel Havers, Alice Krige, Ian Holm",True
286,Atlantic City,7.3,1980,1h 44m,Louis Malle,"Drama, Policial, Romance","Louis Malle, John Guare","Burt Lancaster, Susan Sarandon, Kate Reid, Al Waxman, Robert Joy",False
287,Coal Miner's Daughter,7.5,1980,2h 4m,Michael Apted,"Biografia, Drama, Musical","Thomas Rickman, Loretta Lynn, George Vecsey","Sissy Spacek, Tommy Lee Jones, Levon Helm, Phyllis Boyens, Bill Anderson Jr.",False
288,Raging Bull,8.1,1980,2h 9m,Martin Scorsese,"Biografia, Drama, Esportes","Christopher De Vore, Eric Bergren, David Lynch","John Hurt, Anthony Hopkins, Anne Bancroft, John Gielgud, Wendy Hiller",False
289,The Elephant Man,8.2,1980,2h 4m,David Lynch,"Biografia, Drama","Christopher De Vore, Eric Bergren, David Lynch","John Hurt, Anthony Hopkins, Anne Bancroft, John Gielgud, Wendy Hiller",False
290,Apocalypse Now,8.4,1979,2h 27m,Francis Ford Coppola,"Drama, Guerra, Mistério",Alvin Sargent,"Donald Sutherland, Timothy Hutton, Mary Tyler Moore, Judd Hirsch, Elizabeth McGovern",True
291,Tess,7.3,1979,3h 6m,Roman Polanski,"Drama, Romance",Steve Tesich,"Dennis Christopher, Dennis Quaid, Daniel Stern, Jackie Earle Haley, Paul Dooley",True
292,All That Jazz,7.8,1979,2h 3m,Bob Fosse,"Drama, Musical, Musical","Robert Alan Aurthur, Bob Fosse","Roy Scheider, Jessica Lange, Ann Reinking, Leland Palmer, Cliff Gorman",False
293,Breaking Away,7.7,1979,1h 41m,Peter Yates,"Comédia, Drama, Esportes","Irving Ravetch, Harriet Frank Jr.","Sally Field, Beau Bridges, Ron Leibman, Pat Hingle, Barbara Baxley",False
294,Kramer vs. Kramer,7.8,1979,1h 45m,Robert Benton,Drama,"Avery Corman, Robert Benton","Dustin Hoffman, Meryl Streep, Jane Alexander, Justin Henry, Howard Duff",False
295,Norma Rae,7.3,1979,1h 54m,Martin Ritt,Drama,"Irving Ravetch, Harriet Frank Jr.","Sally Field, Beau Bridges, Ron Leibman, Pat Hingle, Barbara Baxley",False
296,An Unmarried Woman,7.2,1978,2h 4m,Paul Mazursky,"Comédia, Drama, Romance",Paul Mazursky,"Jill Clayburgh, Alan Bates, Michael Murphy, Lynne Thigpen, Cliff Gorman",False
297,Coming Home,7.3,1978,2h 7m,Hal Ashby,"Drama, Guerra, Romance","Oliver Stone, Gerald Di Pego","Brad Davis, Irene Miracle, John Hurt, Paul L. Smith, Randy Quaid",False
298,Heaven Can Wait,6.9,1978,1h 41m,"Warren Beatty, Buck Henry","Comédia, Fantasia, Romance","Elaine May, Warren Beatty, Harry Segall","Warren Beatty, James Mason, Julie Christie, Jack Warden, Charles Grodin",False
299,Midnight Express,7.5,1978,2h 1m,Alan Parker,"Biografia, Drama, Policial, Suspense","Robert C. Jones, Waldo Salt","Jon Voight, Jane Fonda, Bruce Dern, Penelope Milford, Robert Carradine",False
300,The Deer Hunter,8.1,1978,3h 3m,Michael Cimino,"Drama, Guerra","Michael Cimino, Deric Washburn, Louis Garfinkle","Robert De Niro, Christopher Walken, John Cazale, John Savage, Meryl Streep",False
301,Annie Hall,7.9,1977,1h 33m,Woody Allen,"Comédia, Romance","Woody Allen, Marshall Brickman","Woody Allen, Diane Keaton, Tony Roberts, Paul Simon, Carol Kane",True
302,The Turning Point,6.8,1977,1h 59m,Herbert Ross,"Drama, Musical, Romance","Woody Allen, Marshall Brickman","Woody Allen, Diane Keaton, Tony Roberts, Paul Simon, Carol Kane",True
303,Julia,7.0,1977,1h 57m,Fred Zinnemann,Drama,George Lucas,"Mark Hamill, Harrison Ford, Carrie Fisher, Alec Guinness, Peter Cushing",False
304,Star Wars,8.6,1977,2h 1m,George Lucas,"Aventura, Ação, Fantasia, Ficção científica",George Lucas,"Mark Hamill, Harrison Ford, Carrie Fisher, Alec Guinness, Peter Cushing",False
305,The Goodbye Girl,7.4,1977,1h 51m,Herbert Ross,"Comédia, Drama, Romance",Neil Simon,"Richard Dreyfuss, Marsha Mason, Paul Benedict, Austin Pendleton, John Beal",False
306,Rocky,8.1,1976,2h,John G. Avildsen,"Drama, Esportes",Sylvester Stallone,"Sylvester Stallone, Talia Shire, Burt Young, Carl Weathers, Burgess Meredith",True
307,Taxi Driver,8.2,1976,1h 54m,Martin Scorsese,"Drama, Policial",Sylvester Stallone,"Sylvester Stallone, Talia Shire, Burt Young, Carl Weathers, Burgess Meredith",True
308,All the President's Men,7.9,1976,2h 18m,Alan J. Pakula,"Drama, História, Suspense",William Goldman,"Robert Redford, Dustin Hoffman, Jason Robards, Martin Balsam, Jack Warden",False
309,Bound for Glory,7.2,1976,2h 27m,Hal Ashby,"Biografia, Drama, Musical",Paul Schrader,"Robert De Niro, Jodie Foster, Cybill Shepherd, Harvey Keitel, Peter Boyle",False
310,Network,8.1,1976,2h 1m,Sidney Lumet,Drama,William Goldman,"Robert Redford, Dustin Hoffman, Jason Robards, Martin Balsam, Jack Warden",False
311,Barry Lyndon,8.1,1975,3h 5m,Stanley Kubrick,"Aventura, Drama, Guerra","Robert Altman, Joan Tewkesbury","Ronee Blakley, Keith Carradine, Lily Tomlin, Karen Black, Ned Beatty",False
312,Dog Day Afternoon,8.0,1975,2h 5m,Sidney Lumet,"Biografia, Drama, Policial, Suspense","Peter Benchley, Carl Gottlieb","Roy Scheider, Robert Shaw, Richard Dreyfuss, Lorraine Gary, Murray Hamilton",False
313,Jaws,8.1,1975,2h 4m,Steven Spielberg,"Aventura, Suspense, Terror",Frank Pierson,"Al Pacino, John Cazale, Charles Durning, Chris Sarandon, Penelope Allen",False
314,Nashville,7.6,1975,2h 40m,Robert Altman,"Comédia, Drama, Musical","Robert Altman, Joan Tewkesbury","Ronee Blakley, Keith Carradine, Lily Tomlin, Karen Black, Ned Beatty",False
315,One Flew Over the Cuckoo's Nest,8.7,1975,2h 13m,Milos Forman,Drama,"Lawrence Hauben, Bo Goldman, Ken Kesey","Jack Nicholson, Louise Fletcher, Michael Berryman, Peter Brocco, Dean R. Brooks",False
316,The Conversation,7.7,1974,1h 53m,Francis Ford Coppola,"Drama, Mistério, Suspense","Francis Ford Coppola, Mario Puzo","Al Pacino, Robert De Niro, Robert Duvall, Diane Keaton, Talia Shire",True
317,The Godfather Part II,9.0,1974,3h 22m,Francis Ford Coppola,"Drama, Policial","Francis Ford Coppola, Mario Puzo","Al Pacino, Robert De Niro, Robert Duvall, Diane Keaton, Talia Shire",True
318,The Towering Inferno,7.0,1974,2h 45m,John Guillermin,"Ação, Drama, Suspense","Richard Martin Stern, Thomas N. Scortia, Frank M. Robinson","Paul Newman, Steve McQueen, William Holden, Faye Dunaway, Fred Astaire",True
319,Chinatown,8.1,1974,2h 10m,Roman Polanski,"Drama, Mistério, Suspense",Francis Ford Coppola,"Gene Hackman, John Cazale, Allen Garfield, Cindy Williams, Frederic Forrest",False
320,Lenny,7.5,1974,1h 51m,Bob Fosse,"Biografia, Drama",Julian Barry,"Dustin Hoffman, Valerie Perrine, Jan Miner, Stanley Beck, Frankie Man",False
321,A Touch of Class,6.5,1973,1h 46m,Melvin Frank,"Comédia, Romance",Melvin Frank,"George Segal, Glenda Jackson, Paul Sorvino, K Callan, John Randolph",False
322,American Graffiti,7.4,1973,1h 50m,George Lucas,"Comédia, Drama",George Lucas,"Richard Dreyfuss, Ron Howard, Paul Le Mat, Cindy Williams, Charles Martin Smith",False
323,Cries and Whispers,8.1,1973,2h 2m,William Friedkin,Terror,Ingmar Bergman,"Harriet Andersson, Kari Sylwan, Ingrid Thulin, Liv Ullmann, Erland Josephson",False
324,The Sting,8.2,1973,2h 9m,George Roy Hill,"Comédia, Drama, Policial",George Lucas,"Richard Dreyfuss, Ron Howard, Paul Le Mat, Cindy Williams, Charles Martin Smith",False
325,Cabaret,7.8,1972,2h 4m,Bob Fosse,"Drama, Musical, Musical, Romance","Joe Masteroff, John Van Druten, Christopher Isherwood","Liza Minnelli, Michael York, Helmut Griem, Joel Grey, Fritz Wepper",True
326,Deliverance,7.6,1972,1h 49m,John Boorman,"Aventura, Drama, Suspense",James Dickey,"Jon Voight, Burt Reynolds, Ned Beatty, Ronny Cox, Billy Redden",False
327,Sounder,7.5,1972,1h 45m,Martin Ritt,"Drama, Família",Lonne Elder III,"Cicely Tyson, Paul Winfield, Kevin Hooks, Taj Mahal, Paul Hamilton",False
328,The Emigrants,7.9,1972,1h 32m,Ingmar Bergman,Drama,"Jan Troell, Bengt Forslund","Max von Sydow, Liv Ullmann, Eddie Axberg, Allan Edwall, Pierre Lindstedt",False
329,The Godfather,9.2,1972,2h 55m,Francis Ford Coppola,"Drama, Policial",Lonne Elder III,"Cicely Tyson, Paul Winfield, Kevin Hooks, Taj Mahal, Paul Hamilton",False
330,Fiddler on the Roof,8.0,1971,3h 1m,Norman Jewison,"Drama, Família, Musical, Romance","Mario Puzo, Francis Ford Coppola","Marlon Brando, Al Pacino, Robert Duvall, Diane Keaton, Richard S. Castellano",True
331,A Clockwork Orange,8.2,1971,2h 16m,Stanley Kubrick,"Ficção científica, Policial","Stanley Kubrick, Anthony Burgess","Malcolm McDowell, Patrick Magee, Michael Bates, Warren Clarke, James Marcus",False
332,Nicholas and Alexandra,7.2,1971,3h 3m,Franklin J. Schaffner,"Biografia, Drama, Guerra, História","Robert K. Massie, Edward Bond, James Goldman","Michael Jayston, Janet Suzman, Roderic Noble, Ania Marson, Lynne Frederick",False
333,The Emigrants,8.0,1971,3h 11m,Jan Troell,"Drama, História","Jan Troell, Bengt Forslund","Max von Sydow, Liv Ullmann, Eddie Axberg, Allan Edwall, Pierre Lindstedt",False
334,The French Connection,7.7,1971,1h 44m,William Friedkin,"Ação, Drama, Policial, Suspense","Stanley Kubrick, Anthony Burgess","Malcolm McDowell, Patrick Magee, Michael Bates, Warren Clarke, James Marcus",False
335,The Last Picture Show,8.0,1971,1h 58m,Peter Bogdanovich,"Drama, Romance","Larry McMurtry, Peter Bogdanovich","Timothy Bottoms, Jeff Bridges, Cybill Shepherd, Ben Johnson, Cloris Leachman",False
336,Airport,6.6,1970,2h 17m,"George Seaton, Henry Hathaway","Ação, Drama, Suspense",Ring Lardner Jr.,"Donald Sutherland, Elliott Gould, Tom Skerritt, Sally Kellerman, Robert Duvall",False
337,Five Easy Pieces,7.4,1970,1h 38m,Bob Rafelson,Drama,Erich Segal,"Ali MacGraw, Ryan O'Neal, John Marley, Ray Milland, Tom Skerritt",False
338,Love Story,6.9,1970,1h 40m,Arthur Hiller,"Drama, Romance","Bob Rafelson, Adrien Joyce","Jack Nicholson, Karen Black, Susan Anspach, Sally Struthers, Toni Basil",False
339,MASH,7.3,1970,1h 56m,Robert Altman,"Comédia, Drama, Guerra",Ring Lardner Jr.,"Donald Sutherland, Elliott Gould, Tom Skerritt, Sally Kellerman, Robert Duvall",False
340,Patton,7.9,1970,2h 52m,Franklin J. Schaffner,"Biografia, Drama, Guerra","Francis Ford Coppola, Edmund H. North, Ladislas Farago","George C. Scott, Karl Malden, Stephen Young, Michael Strong, Carey Loftin",False
341,Midnight Cowboy,7.8,1969,1h 53m,John Schlesinger,Drama,Waldo Salt,"Dustin Hoffman, Jon Voight, Sylvia Miles, John McGiver, Brenda Vaccaro",True
342,Z,8.1,1969,2h 7m,Costa-Gavras,"Drama, Policial, Suspense",Waldo Salt,"Dustin Hoffman, Jon Voight, Sylvia Miles, John McGiver, Brenda Vaccaro",True
343,Anne of the Thousand Days,7.4,1969,2h 25m,Charles Jarrott,"Biografia, Drama, História","Bridget Boland, John Hale, Richard Sokolove","Richard Burton, Geneviève Bujold, Irene Papas, Anthony Quayle, John Colicos",False
344,Butch Cassidy and the Sundance Kid,8.0,1969,1h 50m,George Roy Hill,"Aventura, Biografia, Drama, Faroeste, Policial","Costa-Gavras, Jorge Semprún","Jean-Louis Trintignant, Yves Montand, Irene Papas, Charles Denner, Georges Géret",False
345,"Hello, Dolly!",7.0,1969,2h 26m,Gene Kelly,"Aventura, Comédia, Musical, Romance","Michael Stewart, Thornton Wilder, Ernest Lehman","Barbra Streisand, Walter Matthau, Michael Crawford, Marianne McAndrew, Danny Lockin",False
346,Romeo and Juliet,7.6,1968,2h 18m,Franco Zeffirelli,"Drama, Romance","William Shakespeare, Franco Brusati, Masolino D'Amico","Leonard Whiting, Olivia Hussey, John McEnery, Milo O'Shea, Pat Heywood",True
347,Funny Girl,7.4,1968,2h 31m,William Wyler,"Biografia, Comédia, Drama, Musical, Romance",Stewart Stern,"Joanne Woodward, James Olson, Kate Harrington, Stephen Elliott, Estelle Parsons",False
348,Oliver!,7.4,1968,2h 33m,Carol Reed,"Drama, Família, Musical",James Goldman,"Peter O'Toole, Katharine Hepburn, Anthony Hopkins, Timothy Dalton, Nigel Terry",False
349,"Rachel, Rachel",7.1,1968,1h 41m,Paul Newman,"Drama, Romance",Stewart Stern,"Joanne Woodward, James Olson, Kate Harrington, Stephen Elliott, Estelle Parsons",False
350,The Lion in Winter,7.8,1968,2h 14m,Anthony Harvey,"Biografia, Drama, História",James Goldman,"Peter O'Toole, Katharine Hepburn, Anthony Hopkins, Timothy Dalton, Nigel Terry",False
351,In the Heat of the Night,7.9,1967,1h 50m,Norman Jewison,"Drama, Mistério, Suspense",Stirling Silliphant,"Sidney Poitier, Rod Steiger, Warren Oates, Lee Grant, James Anderson",True
352,The Graduate,8.0,1967,1h 46m,Mike Nichols,"Comédia, Drama, Romance",Stirling Silliphant,"Sidney Poitier, Rod Steiger, Warren Oates, Lee Grant, James Anderson",True
353,Bonnie and Clyde,7.7,1967,1h 51m,Arthur Penn,"Ação, Biografia, Drama, Policial",William Rose,"Spencer Tracy, Sidney Poitier, Katharine Hepburn, Katharine Houghton, Cecil Kellaway",False
354,Doctor Dolittle,6.2,1967,2h 32m,Richard Fleischer,"Aventura, Comédia, Família, Fantasia, Musical, Romance","Hugh Lofting, Leslie Bricusse","Rex Harrison, Samantha Eggar, Anthony Newley, Richard Attenborough, Peter Bull",False
355,Guess Who's Coming to Dinner,7.8,1967,1h 48m,Stanley Kramer,"Comédia, Drama",William Rose,"Spencer Tracy, Sidney Poitier, Katharine Hepburn, Katharine Houghton, Cecil Kellaway",False
356,A Man for All Seasons,7.7,1966,2h,Fred Zinnemann,"Biografia, Drama, História",Robert Bolt,"Paul Scofield, Wendy Hiller, Robert Shaw, Leo McKern, Orson Welles",True
357,Who's Afraid of Virginia Woolf?,8.0,1966,2h 11m,Mike Nichols,Drama,"Ernest Lehman, Edward Albee","Elizabeth Taylor, Richard Burton, George Segal, Sandy Dennis, Agnes Flanagan",True
358,The Russians Are Coming! The Russians Are Coming!,7.0,1966,1h 54m,Lewis Gilbert,"Comédia, Drama",William Rose,"Carl Reiner, Eva Marie Saint, Alan Arkin, Brian Keith, Jonathan Winters",False
359,The Sand Pebbles,7.5,1966,3h 2m,Robert Wise,"Aventura, Drama, Guerra, Romance","Richard McKenna, Robert Anderson","Steve McQueen, Richard Attenborough, Richard Crenna, Candice Bergen, Emmanuelle Arsan",False
360,Ship of Fools,7.1,1965,2h 29m,Stanley Kramer,"Drama, Guerra, Romance","Katherine Anne Porter, Abby Mann","Vivien Leigh, Simone Signoret, José Ferrer, Lee Marvin, Oskar Werner",True
361,A Thousand Clowns,7.3,1965,1h 58m,Fred Coe,"Comédia, Drama, Romance",Herb Gardner,"Jason Robards, Martin Balsam, Barbara Harris, Barry Gordon, Sandy Dennis",False
362,Darling,7.0,1965,2h 8m,John Schlesinger,"Drama, Romance",Frederic Raphael,"Julie Christie, Dirk Bogarde, Laurence Harvey, José Luis de Villalonga, Roland Culver",False
363,Doctor Zhivago,7.9,1965,3h 17m,David Lean,"Drama, Guerra, Romance",Herb Gardner,"Jason Robards, Martin Balsam, Barbara Harris, Barry Gordon, Sandy Dennis",False
364,The Sound of Music,8.1,1965,2h 52m,Robert Wise,"Biografia, Drama, Família, Musical, Romance","Georg Hurdalek, Howard Lindsay, Russel Crouse","Julie Andrews, Christopher Plummer, Eleanor Parker, Richard Haydn, Peggy Wood",False
365,Alexis Zorbas,7.6,1964,2h 22m,Michael Cacoyannis,"Comédia, Drama",Michael Cacoyannis,"Anthony Quinn, Alan Bates, Irene Papas, Lila Kedrova, Sotiris Moustakas",False
366,Becket,7.7,1964,2h 28m,Peter Glenville,"Biografia, Drama, História","Stanley Kubrick, Peter George, Terry Southern","Peter Sellers, George C. Scott, Sterling Hayden, Keenan Wynn, Slim Pickens",False
367,Dr. Strangelove or: How I Learned to Stop Worrying and Love the Bomb,8.3,1964,1h 35m,Stanley Kubrick,"Comédia, Guerra","Stanley Kubrick, Peter George, Terry Southern","Peter Sellers, George C. Scott, Sterling Hayden, Keenan Wynn, Slim Pickens",False
368,Mary Poppins,7.8,1964,2h 19m,Robert Stevenson,"Comédia, Família, Fantasia, Musical","Bill Walsh, Don DaGradi, P.L. Travers","Julie Andrews, Dick Van Dyke, David Tomlinson, Glynis Johns, Hermione Baddeley",False
369,My Fair Lady,7.7,1964,2h 50m,George Cukor,"Drama, Família, Musical, Romance",Michael Cacoyannis,"Anthony Quinn, Alan Bates, Irene Papas, Lila Kedrova, Sotiris Moustakas",False
370,Cleopatra,7.0,1963,3h 12m,Joseph L. Mankiewicz,"Biografia, Drama, História","Joseph L. Mankiewicz, Ranald MacDougall, Sidney Buchman","Elizabeth Taylor, Richard Burton, Rex Harrison, Pamela Brown, George Cole",True
371,Tom Jones,6.4,1963,2h 9m,Tony Richardson,"Aventura, Comédia, História, Romance",John Osborne,"Albert Finney, Susannah York, Diane Cilento, Hugh Griffith, Edith Evans",True
372,America America,7.7,1963,2h 54m,Elia Kazan,"Aventura, Drama",Elia Kazan,"Stathis Giallelis, Estelle Hemsley, Lou Antonio, Salem Ludwig, Harry Davis",False
373,Lilies of the Field,7.5,1963,1h 34m,Ralph Nelson,"Comédia, Drama",Elia Kazan,"Stathis Giallelis, Estelle Hemsley, Lou Antonio, Salem Ludwig, Harry Davis",False
374,Lawrence of Arabia,8.3,1962,3h 47m,David Lean,"Aventura, Biografia, Drama, Guerra",John Osborne,"Albert Finney, Susannah York, Diane Cilento, Hugh Griffith, Edith Evans",True
375,How the West Was Won,7.1,1962,2h 44m,"John Ford, Henry Hathaway, George Marshall, Richard Thorpe","Aventura, Ação, Faroeste, Guerra","James Stewart, John Wayne, Gregory Peck","James Stewart, John Wayne, Gregory Peck, Henry Fonda, Carroll Baker",False
376,Mutiny on the Bounty,7.2,1962,2h 58m,"Lewis Milestone, Carol Reed, George Seaton","Aventura, Drama, História, Romance","Charles Lederer, Charles Nordhoff, James Norman Hall","Marlon Brando, Trevor Howard, Richard Harris, Hugh Griffith, Richard Haydn",False
377,The Longest Day,7.7,1962,2h 58m,"Ken Annakin, Andrew Marton, Gerd Oswald, Bernhard Wicki, Darryl F. Zanuck","Ação, Drama, Guerra, História","Marion Hargrove, Willard Waterman","Robert Preston, Shirley Jones, Buddy Hackett, Hermione Gingold, Ron Howard",False
378,The Music Man,7.7,1962,2h 31m,Morton DaCosta,"Comédia, Família, Musical, Romance","Cornelius Ryan, Frank Davis, James Webb","John Wayne, Robert Mitchum, Sean Connery, Richard Burton, Henry Fonda",False
379,To Kill a Mockingbird,8.3,1962,2h 9m,Robert Mulligan,"Drama, Policial","Harper Lee, Horton Foote","Gregory Peck, John Megna, Frank Overton, Rosemary Murphy, Ruth White",False
380,The Hustler,7.9,1961,2h 14m,Robert Rossen,"Drama, Esportes","Sidney Carroll, Robert Rossen, Walter Tevis","Paul Newman, Jackie Gleason, Piper Laurie, George C. Scott, Myron McCormick",True
381,West Side Story,7.6,1961,2h 33m,"Jerome Robbins, Robert Wise","Crime, Drama, Musical","Ernest Lehman, Arthur Laurents, Jerome Robbins","Natalie Wood, George Chakiris, Richard Beymer, Russ Tamblyn, Rita Moreno",True
382,Fanny,6.8,1961,2h 14m,Joshua Logan,"Drama, Romance","S.N. Behrman, Joshua Logan, Marcel Pagnol","Leslie Caron, Maurice Chevalier, Charles Boyer, Horst Buchholz, Georgette Anys",False
383,Judgment at Nuremberg,8.3,1961,2h 59m,Stanley Kramer,"Drama, Guerra, História","Carl Foreman, Brian Garfield","Gregory Peck, David Niven, Anthony Quinn, Stanley Baker, James Darren",False
384,The Guns of Navarone,7.5,1961,2h 38m,J. Lee Thompson,"Aventura, Ação, Drama, Guerra","Carl Foreman, Brian Garfield","Gregory Peck, David Niven, Anthony Quinn, Stanley Baker, James Darren",False
385,Elmer Gantry,7.7,1960,2h 26m,Richard Brooks,Drama,Richard Brooks,"Burt Lancaster, Jean Simmons, Dean Jagger, Arthur Kennedy, Walter Huston",True
386,The Apartment,8.3,1960,2h 5m,Billy Wilder,"Comédia, Drama, Romance",Richard Brooks,"Burt Lancaster, Jean Simmons, Dean Jagger, Arthur Kennedy, Walter Huston",True
387,Sons and Lovers,7.1,1960,1h 43m,Jack Cardiff,Drama,Dalton Trumbo,"Robert Mitchum, Deborah Kerr, Peter Ustinov, Glynis Johns, Chips Rafferty",False
388,The Alamo,6.8,1960,2h 42m,John Wayne,"Aventura, Drama, Faroeste, Guerra, História",James Edward Grant,"John Wayne, Richard Widmark, Laurence Harvey, Frankie Avalon, Patrick Wayne",False
389,The Sundowners,7.1,1960,2h 13m,Fred Zinnemann,"Drama, Faroeste",Dalton Trumbo,"Robert Mitchum, Deborah Kerr, Peter Ustinov, Glynis Johns, Chips Rafferty",False
390,Ben-Hur,8.1,1959,3h 32m,William Wyler,"Aventura, Drama","Lew Wallace, Karl Tunberg, Gore Vidal","Charlton Heston, Jack Hawkins, Stephen Boyd, Haya Harareet, Hugh Griffith",True
391,Anatomy of a Murder,8.0,1959,2h 41m,Otto Preminger,"Drama, Mistério","Wendell Mayes, John D. Voelker","James Stewart, Lee Remick, Ben Gazzara, Arthur O'Connell, Eve Arden",False
392,The Diary of Anne Frank,7.4,1959,3h,George Stevens,"Biografia, Drama, Família, Guerra, História",Neil Paterson,"Laurence Harvey, Simone Signoret, Heather Sears, Donald Wolfit, Donald Houston",False
393,The Nun's Story,7.5,1959,2h 29m,Fred Zinnemann,Drama,"Robert Anderson, Kathryn Hulme","Audrey Hepburn, Peter Finch, Edith Evans, Peggy Ashcroft, Dean Jagger",False
394,Gigi,6.6,1958,1h 55m,"Vincente Minnelli, Charles Walters","Comédia, Musical, Romance","Alan Jay Lerner, Colette, Niven Busch","Leslie Caron, Maurice Chevalier, Louis Jourdan, Hermione Gingold, Eva Gabor",True
395,The Defiant Ones,7.6,1958,1h 36m,Stanley Kramer,"Drama, Policial","Nedrick Young, Harold Jacob Smith","Tony Curtis, Sidney Poitier, Theodore Bikel, Charles McGraw, Lon Chaney Jr.",True
396,Auntie Mame,7.9,1958,2h 23m,Morton DaCosta,"Comédia, Drama, Romance","Betty Comden, Adolph Green, Patrick Dennis","Rosalind Russell, Forrest Tucker, Coral Browne, Fred Clark, Roger Smith",False
397,Cat on a Hot Tin Roof,7.9,1958,1h 48m,Richard Brooks,Drama,"Richard Brooks, James Poe, Tennessee Williams","Elizabeth Taylor, Paul Newman, Burl Ives, Jack Carson, Judith Anderson",False
398,Room at the Top,7.5,1958,1h 57m,Jack Clayton,"Drama, Romance",Neil Paterson,"Laurence Harvey, Simone Signoret, Heather Sears, Donald Wolfit, Donald Houston",False
399,Separate Tables,7.3,1958,1h 40m,Delbert Mann,"Drama, Romance","Terence Rattigan, John Gay, John Michael Hayes","Rita Hayworth, Deborah Kerr, David Niven, Burt Lancaster, Wendy Hiller",False
400,The Bridge on the River Kwai,8.1,1957,2h 41m,David Lean,"Aventura, Drama, Guerra","Pierre Boulle, Carl Foreman, Michael Wilson","William Holden, Alec Guinness, Jack Hawkins, Sessue Hayakawa, James Donald",True
401,12 Angry Men,9.0,1957,1h 36m,Sidney Lumet,"Drama, Policial","Agatha Christie, Billy Wilder, Harry Kurnitz","Tyrone Power, Marlene Dietrich, Charles Laughton, Elsa Lanchester, Henry Daniell",False
402,Peyton Place,7.2,1957,2h 37m,Mark Robson,"Drama, Mistério, Policial, Romance","John Michael Hayes, Grace Metalious","Lana Turner, Lee Philips, Lloyd Nolan, Arthur Kennedy, Russ Tamblyn",False
403,Sayonara,7.0,1957,2h 27m,Joshua Logan,"Drama, Romance","Paul Osborn, James A. Michener","Marlon Brando, Ricardo Montalban, Patricia Owens, James Garner, Martha Scott",False
404,Witness for the Prosecution,8.4,1957,1h 56m,Billy Wilder,"Drama, Mistério, Policial, Suspense",Reginald Rose,"Henry Fonda, Lee J. Cobb, Martin Balsam, John Fiedler, E.G. Marshall",False
405,Around the World in Eighty Days,6.7,1956,2h 47m,"Michael Anderson, John Farrow","Aventura, Comédia, Família, Romance","James Poe, John Farrow, S.J. Perelman","David Niven, Cantinflas, Shirley MacLaine, Robert Newton, Michael Todd",True
406,Friendly Persuasion,7.3,1956,2h 17m,William Wyler,"Drama, Família, Faroeste, Guerra, Romance","Michael Wilson, Dalton Trumbo","Gary Cooper, Dorothy McGuire, Anthony Perkins, Jean Simmons, Walter Brennan",False
407,Giant,7.6,1956,3h 21m,George Stevens,"Drama, Faroeste","Ivan Moffat, Fred Guiol, Edgar Nixon","Elizabeth Taylor, Rock Hudson, James Dean, Carroll Baker, Dennis Hopper",False
408,The King and I,7.4,1956,2h 13m,Walter Lang,"Biografia, Drama, Musical, Romance","Ivan Moffat, Fred Guiol, Edgar Nixon","Elizabeth Taylor, Rock Hudson, James Dean, Carroll Baker, Dennis Hopper",False
409,The Ten Commandments,7.9,1956,3h 40m,Cecil B. DeMille,"Aventura, Drama, Família, História","Michael Wilson, Dalton Trumbo","Gary Cooper, Dorothy McGuire, Anthony Perkins, Jean Simmons, Walter Brennan",False
410,The Rose Tattoo,6.9,1955,1h 57m,Daniel Mann,"Comédia, Drama, Romance","James Poe, John Farrow, S.J. Perelman","David Niven, Cantinflas, Shirley MacLaine, Robert Newton, Michael Todd",True
411,Love Is a Many-Splendored Thing,6.4,1955,1h 42m,"Henry King, Otto Lang","Biografia, Drama, Guerra, Romance","John Patrick, Han Suyin","William Holden, Jennifer Jones, Torin Thatcher, Isobel Elsom, Murray Matheson",False
412,Marty,7.6,1955,1h 30m,Delbert Mann,"Drama, Romance",Daniel Taradash,"William Holden, Kim Novak, Rosalind Russell, Cliff Robertson, Paul Newman",False
413,Mister Roberts,7.6,1955,2h 3m,"John Ford, Mervyn LeRoy, Joshua Logan","Comédia, Drama, Guerra","Frank Tarloff, John Monks Jr., Joshua Logan","Henry Fonda, James Cagney, William Powell, Jack Lemmon, Robert Walker",False
