#,título,avaliacao_imdb,ano,duração,direção,gêneros,roteiro,elenco_principal,vencedor,indicação,ano_do_oscar
0,The Substance,7.2,2024,2h 21m,Coralie Fargeat,"Drama, Terror, Ficção científica",Coralie Fargeat,"Demi Moore, Margaret Qualley, Dennis Quaid, Edward Hamilton-Clark, Gore Abrams",False,Best Motion Picture of the Year,2025.0
1,Wicked: Part I,7.4,2024,2h 40m,Jon M. Chu,"Fantasia, Musical, Romance","Winnie Holzman, Dana Fox, Gregory Maguire","Cynthia Erivo, Ariana Grande, Jeff Goldblum, Michelle Yeoh, Jonathan Bailey",False,Best Motion Picture of the Year,2025.0
2,Conclave,7.4,2024,2h,Edward Berger,"Drama, Suspense","Peter Straughan, Robert Harrisr","Ralph Fiennes, Stanley Tucci, John Lithgow, Isabella Rossellini, Carlos Diehz",False,Best Motion Picture of the Year,2025.0
3,A Complete Unknown,7.3,2024,2h 21m,James Mangold,"Biografia, Drama, Musical","James Mangold, Jay Cocks, Elijah Wald","Timothée Chalamet, Edward Norton, Monica Barbaro, Elle Fanning, Joe Tippett",False,Best Motion Picture of the Year,2025.0
4,Nickel Boys,6.9,2024,2h 20m,RaMell Ross,Drama,"RaMell Ross, Joslyn Barnes, Colson Whitehead","Ethan Herisse, Brandon Wilson, Aunjanue Ellis-Taylor, Sam Malone, Najah Bradley",False,Best Motion Picture of the Year,2025.0
5,Dune: Part Two,8.5,2024,2h 46m,Denis Villeneuve,"Ação, Aventura, Drama, Ficção científica","Denis Villeneuve, Jon Spaihts, Frank Herbert","Timothée Chalamet, Zendaya, Javier Bardem, Josh Brolin, Florence Pugh",False,Best Motion Picture of the Year,2025.0
6,The Brutalist,7.3,2024,3h 36m,Brady Corbet,Drama,"Brady Corbet, Mona Fastvold","Adrien Brody, Felicity Jones, Guy Pearce, Joe Alwyn, Raffey Cassidy",False,Best Motion Picture of the Year,2025.0
7,Anora,7.4,2024,2h 19m,Sean Baker,"Comédia, Drama, Romance",Sean Baker,"Mikey Madison, Mark Eydelshteyn, Yura Borisov, Paul Weissman, Karren Karagulian",True,Best Motion Picture of the Year,2025.0
8,Emilia Pérez,5.4,2024,2h 12m,Jacques Audiard,"Policial, Drama, Musical, Suspense","Jacques Audiard, Thomas Bidegain, Léa Mysius","Zoe Saldaña, Karla Sofía Gascón, Selena Gomez, Adriana Paz, Edgar Ramírez",False,Best Motion Picture of the Year,2025.0
9,Ainda Estou Aqui,8.2,2024,2h 17m,Walter Salles,"Biografia, Drama, História","Murilo Hauser, Heitor Lorega, Marcelo Rubens Paiva","Fernanda Torres, Fernanda Montenegro, Selton Mello, Valentina Herszage, Marjorie Estiano",False,Best Motion Picture of the Year,2025.0
10,The Holdovers,7.9,2023,2h 13m,Alexander Payne,"Comédia, Drama",David Hemingson,"Paul Giamatti, Da'Vine Joy Randolph, Dominic Sessa, Carrie Preston, Brady Hepner",False,Best Motion Picture of the Year,2024.0
11,Maestro,6.5,2023,2h 9m,Bradley Cooper,"Biografia, Drama, História, Musical, Romance","Bradley Cooper, Josh Singer","Bradley Cooper, Carey Mulligan, Matt Bomer, Vincenzo Amato, Greg Hildreth",False,Best Motion Picture of the Year,2024.0
12,Anatomie d'une chute,7.6,2023,2h 31m,Justine Triet,"Policial, Drama, Suspense",,,,,
13,The Zone of Interest,7.3,2023,1h 45m,Jonathan Glazer,"Drama, História, Guerra","Jonathan Glazer, Martin Amis","Christian Friedel, Sandra Hüller, Johann Karthaus, Luis Noah Witte, Max Beck",False,Best Motion Picture of the Year,2024.0
14,Barbie,6.8,2023,1h 54m,Greta Gerwig,"Aventura, Comédia, Fantasia","Greta Gerwig, Noah Baumbach","Margot Robbie, Ryan Gosling, America Ferrera, Will Ferrell, Kate McKinnon",False,Best Motion Picture of the Year,2024.0
15,Past Lives,7.8,2023,1h 45m,Celine Song,"Drama, Romance",Celine Song,"Greta Lee, Teo Yoo, John Magaro, Moon Seung-ah, Leem Seung-min",False,Best Motion Picture of the Year,2024.0
16,American Fiction,7.5,2023,1h 57m,Cord Jefferson,"Comédia, Drama","Cord Jefferson, Percival Everett","Jeffrey Wright, Tracee Ellis Ross, Erika Alexander, Issa Rae, Sterling K. Brown",False,Best Motion Picture of the Year,2024.0
17,Poor Things,7.8,2023,2h 21m,Yorgos Lanthimos,"Comédia, Drama, Romance, Ficção científica","Tony McNamara, Alasdair Gray","Emma Stone, Mark Ruffalo, Willem Dafoe, Margaret Qualley, Ramy Youssef",False,Best Motion Picture of the Year,2024.0
18,Killers of the Flower Moon,7.6,2023,3h 26m,Martin Scorsese,"Policial, Drama, História, Faroeste","Martin Scorsese, Eric Roth, David Grann","Leonardo DiCaprio, Robert De Niro, Lily Gladstone, Jesse Plemons, Brendan Fraser",False,Best Motion Picture of the Year,2024.0
19,Oppenheimer,8.3,2023,3h,Christopher Nolan,"Biografia, Drama, História","Christopher Nolan, Kai Bird, Martin Sherwin","Cillian Murphy, Emily Blunt, Matt Damon, Robert Downey Jr., Florence Pugh",True,Best Motion Picture of the Year,2024.0
20,Top Gun: Maverick,8.2,2022,2h 10m,Joseph Kosinski,"Ação, Drama","Jim Cash, Jack Epps Jr., Peter Craig","Tom Cruise, Jennifer Connelly, Miles Teller, Val Kilmer, Bashir Salahuddin",False,Best Motion Picture of the Year,2023.0
21,Women Talking,6.9,2022,1h 44m,Sarah Polley,Drama,"Sarah Polley, Miriam Toews","Rooney Mara, Claire Foy, Jessie Buckley, Frances McDormand, Judith Ivey",False,Best Motion Picture of the Year,2023.0
22,Triangle of Sadness,7.2,2022,2h 27m,Ruben Östlund,"Comédia, Drama",Ruben Östlund,"Thobias Thorwid, Harris Dickinson, Charlbi Dean, Jiannis Moustos, Vicki Berlin",False,Best Motion Picture of the Year,2023.0
23,Tár,7.4,2022,2h 38m,Todd Field,"Drama, Musical",Todd Field,"Cate Blanchett, Noémie Merlant, Nina Hoss, Sophie Kauer, Adam Gopnik",False,Best Motion Picture of the Year,2023.0
24,Im Westen nichts Neues,7.8,2022,2h 28m,Edward Berger,"Drama, História, Guerra",,,,,
25,The Fabelmans,7.5,2022,2h 31m,Steven Spielberg,Drama,"Steven Spielberg, Tony Kushner","Michelle Williams, Gabriel LaBelle, Paul Dano, Judd Hirsch, Seth Rogen",False,Best Motion Picture of the Year,2023.0
26,Everything Everywhere All at Once,7.8,2022,2h 19m,"Daniel Kwan, Daniel Scheinert","Ação, Aventura, Comédia, Drama, Fantasia, Ficção científica","Daniel Kwan, Daniel Scheinert","Michelle Yeoh, Stephanie Hsu, Jamie Lee Curtis, Ke Huy Quan, James Hong",True,Best Motion Picture of the Year,2023.0
27,Elvis,7.3,2022,2h 39m,Baz Luhrmann,"Biografia, Drama, Musical","Baz Luhrmann, Sam Bromell, Craig Pearce","Tom Hanks, Austin Butler, Olivia DeJonge, Helen Thomson, Richard Roxburgh",False,Best Motion Picture of the Year,2023.0
28,The Banshees of Inisherin,7.7,2022,1h 54m,Martin McDonagh,"Comédia, Drama",Martin McDonagh,"Colin Farrell, Brendan Gleeson, Kerry Condon, Pat Shortt, Gary Lydon",False,Best Motion Picture of the Year,2023.0
29,Avatar: The Way of Water,7.5,2022,3h 12m,James Cameron,"Ação, Aventura, Fantasia, Ficção científica","James Cameron, Rick Jaffa, Amanda Silver","Sam Worthington, Zoe Saldana, Sigourney Weaver, Stephen Lang, Kate Winslet",False,Best Motion Picture of the Year,2023.0
30,Dune: Part One,8.0,2021,2h 35m,Denis Villeneuve,"Ação, Aventura, Drama, Ficção científica",,,,,
31,Licorice Pizza,7.1,2021,2h 13m,Paul Thomas Anderson,"Comédia, Drama, Romance",Paul Thomas Anderson,"Alana Haim, Cooper Hoffman, Sean Penn, Tom Waits, Will Angarola",False,Best Motion Picture of the Year,2022.0
32,Doraibu mai kâ,7.5,2021,2h 59m,Ryûsuke Hamaguchi,Drama,,,,,
33,Don't Look Up,7.2,2021,2h 18m,Adam McKay,"Comédia, Drama, Ficção científica","Adam McKay, David Sirota","Leonardo DiCaprio, Jennifer Lawrence, Meryl Streep, Cate Blanchett, Rob Morgan",False,Best Motion Picture of the Year,2022.0
34,King Richard,7.5,2021,2h 24m,Reinaldo Marcus Green,"Biografia, Drama, Esportes",Zach Baylin,"Will Smith, Aunjanue Ellis-Taylor, Jon Bernthal, Saniyya Sidney, Demi Singleton",False,Best Motion Picture of the Year,2022.0
35,CODA,8.0,2021,1h 51m,Sian Heder,"Comédia, Drama, Musical","Sian Heder, Victoria Bedos, Stanislas Carré de Malberg","Emilia Jones, Marlee Matlin, Troy Kotsur, Daniel Durant, John Fiore",True,Best Motion Picture of the Year,2022.0
36,"titulo_lower
west side story    West Side Story
west side story    West Side Story
Name: título, dtype: object",7.1,2021,2h 36m,Steven Spielberg,"Policial, Drama, Musical, Romance","titulo_lower
west side story                     Tony Kushner, Arthur Laurents
west side story    Ernest Lehman, Arthur Laurents, Jerome Robbins
Name: roteiro, dtype: object","titulo_lower
west side story    Ansel Elgort, Rachel Zegler, Ariana DeBose, Da...
west side story    Natalie Wood, George Chakiris, Richard Beymer,...
Name: elenco_principal, dtype: object","titulo_lower
west side story    False
west side story     True
Name: vencedor, dtype: object","titulo_lower
west side story    Best Motion Picture of the Year
west side story         Best Cinematography, Color
Name: indicação, dtype: object","titulo_lower
west side story    2022.0
west side story    1962.0
Name: ano_do_oscar, dtype: float64"
37,Belfast,7.2,2021,1h 38m,Kenneth Branagh,"Biografia, Drama",Kenneth Branagh,"Jude Hill, Lewis McAskie, Caitríona Balfe, Jamie Dornan, Judi Dench",False,Best Motion Picture of the Year,2022.0
38,The Power of the Dog,6.8,2021,2h 6m,Jane Campion,"Drama, Faroeste","Jane Campion, Thomas Savage","Benedict Cumberbatch, Kirsten Dunst, Jesse Plemons, Kodi Smit-McPhee, Geneviève Lemon",False,Best Motion Picture of the Year,2022.0
39,Nightmare Alley,7.0,2021,2h 30m,Guillermo del Toro,"Policial, Drama, Suspense","Guillermo del Toro, Kim Morgan, William Lindsay Gresham","Bradley Cooper, Cate Blanchett, Toni Collette, Willem Dafoe, Richard Jenkins",False,Best Motion Picture of the Year,2022.0
40,The Trial of the Chicago 7,7.7,2020,2h 9m,Aaron Sorkin,"Drama, História, Suspense",Aaron Sorkin,"Eddie Redmayne, Alex Sharp, Sacha Baron Cohen, Jeremy Strong, John Carroll Lynch",False,Best Motion Picture of the Year,2021.0
41,Sound of Metal,7.7,2019,2h,Darius Marder,"Drama, Musical","Darius Marder, Abraham Marder, Derek Cianfrance","Riz Ahmed, Olivia Cooke, Paul Raci, Lauren Ridloff, Mathieu Amalric",False,Best Motion Picture of the Year,2021.0
42,Promising Young Woman,7.5,2020,1h 53m,Emerald Fennell,"Policial, Drama, Mistério, Suspense",Emerald Fennell,"Carey Mulligan, Bo Burnham, Alison Brie, Clancy Brown, Adam Brody",False,Best Motion Picture of the Year,2021.0
43,Minari,7.4,2020,1h 55m,Lee Isaac Chung,Drama,Lee Isaac Chung,"Steven Yeun, Yeri Han, Alan Kim, Noel Cho, Darryl Cox",False,Best Motion Picture of the Year,2021.0
44,Mank,6.8,2020,2h 11m,David Fincher,"Biografia, Drama",Jack Fincher,"Gary Oldman, Amanda Seyfried, Lily Collins, Tom Pelphrey, Arliss Howard",False,Best Motion Picture of the Year,2021.0
45,Judas and the Black Messiah,7.4,2021,2h 6m,Shaka King,"Biografia, Drama, História","Will Berson, Shaka King, Kenneth Lucas","LaKeith Stanfield, Daniel Kaluuya, Jesse Plemons, Dominique Fishback, Ashton Sanders",False,Best Motion Picture of the Year,2021.0
46,The Father,8.2,2020,1h 37m,Florian Zeller,"Drama, Mistério","Christopher Hampton, Florian Zeller","Anthony Hopkins, Olivia Colman, Mark Gatiss, Olivia Williams, Imogen Poots",False,Best Motion Picture of the Year,2021.0
47,Nomadland,7.3,2020,1h 47m,Chloé Zhao,Drama,"Chloé Zhao, Jessica Bruder","Frances McDormand, David Strathairn, Linda May, Gay DeForest, Patricia Grier",True,Best Motion Picture of the Year,2021.0
48,Once Upon a Time in... Hollywood,7.6,2019,2h 41m,Quentin Tarantino,"Comédia, Drama",,,,,
49,Marriage Story,7.9,2019,2h 17m,Noah Baumbach,"Drama, Romance",Noah Baumbach,"Adam Driver, Scarlett Johansson, Julia Greer, Azhy Robertson, Wallace Shawn",False,Best Motion Picture of the Year,2020.0
50,"titulo_lower
little women    Little Women
little women    Little Women
Name: título, dtype: object",7.8,2019,2h 15m,Greta Gerwig,"Drama, Romance","titulo_lower
little women                Greta Gerwig, Louisa May Alcott
little women    Andrew Solt, Sarah Y. Mason, Victor Heerman
Name: roteiro, dtype: object","titulo_lower
little women    Saoirse Ronan, Emma Watson, Florence Pugh, Eli...
little women    June Allyson, Peter Lawford, Margaret O'Brien,...
Name: elenco_principal, dtype: object","titulo_lower
little women    False
little women    False
Name: vencedor, dtype: object","titulo_lower
little women    Best Motion Picture of the Year
little women         Best Cinematography, Color
Name: indicação, dtype: object","titulo_lower
little women    2020.0
little women    1950.0
Name: ano_do_oscar, dtype: float64"
51,Joker,8.3,2019,2h 2m,Todd Phillips,"Policial, Drama, Suspense","Todd Phillips, Scott Silver, Bob Kane","Joaquin Phoenix, Robert De Niro, Zazie Beetz, Frances Conroy, Brett Cullen",False,Best Motion Picture of the Year,2020.0
52,Jojo Rabbit,7.9,2019,1h 48m,Taika Waititi,"Comédia, Drama, Guerra","Christine Leunens, Taika Waititi","Roman Griffin Davis, Thomasin McKenzie, Scarlett Johansson, Taika Waititi, Sam Rockwell",False,Best Motion Picture of the Year,2020.0
53,The Irishman,7.8,2019,3h 29m,Martin Scorsese,"Biografia, Policial, Drama, História, Suspense","Steven Zaillian, Charles Brandt","Robert De Niro, Al Pacino, Joe Pesci, Harvey Keitel, Ray Romano",False,Best Motion Picture of the Year,2020.0
54,Ford v Ferrari,8.1,2019,2h 32m,James Mangold,"Ação, Biografia, Drama, Esportes","Jez Butterworth, John-Henry Butterworth, Jason Keller","Matt Damon, Christian Bale, Jon Bernthal, Caitríona Balfe, Josh Lucas",False,Best Motion Picture of the Year,2020.0
55,1917,8.2,2019,1h 59m,Sam Mendes,"Ação, Drama, Guerra","Sam Mendes, Krysty Wilson-Cairns","Dean-Charles Chapman, George MacKay, Daniel Mays, Colin Firth, Pip Carter",False,Best Motion Picture of the Year,2020.0
56,Gisaengchung,8.5,2019,2h 12m,Bong Joon Ho,"Drama, Suspense",,,,,
57,Vice,7.2,2018,2h 12m,Adam McKay,"Biografia, Comédia, Drama, História",Adam McKay,"Christian Bale, Amy Adams, Steve Carell, Sam Rockwell, Alison Pill",False,Best Motion Picture of the Year,2019.0
58,"titulo_lower
a star is born    A Star Is Born
a star is born    A Star Is Born
Name: título, dtype: object",7.6,2018,2h 16m,Bradley Cooper,"Drama, Musical, Romance","titulo_lower
a star is born           Eric Roth, Bradley Cooper, Will Fetters
a star is born    John Gregory Dunne, Joan Didion, Frank Pierson
Name: roteiro, dtype: object","titulo_lower
a star is born    Lady Gaga, Bradley Cooper, Sam Elliott, Greg G...
a star is born    Barbra Streisand, Kris Kristofferson, Gary Bus...
Name: elenco_principal, dtype: object","titulo_lower
a star is born    False
a star is born    False
Name: vencedor, dtype: object","titulo_lower
a star is born    Best Motion Picture of the Year
a star is born                Best Cinematography
Name: indicação, dtype: object","titulo_lower
a star is born    2019.0
a star is born    1977.0
Name: ano_do_oscar, dtype: float64"
59,Roma,7.6,2018,2h 15m,Alfonso Cuarón,Drama,Alfonso Cuarón,"Yalitza Aparicio, Marina de Tavira, Diego Cortina Autrey, Carlos Peralta, Marco Graf",False,Best Motion Picture of the Year,2019.0
60,The Favourite,7.5,2018,1h 59m,Yorgos Lanthimos,"Biografia, Comédia, Drama, História","Deborah Davis, Tony McNamara","Olivia Colman, Emma Stone, Rachel Weisz, Nicholas Hoult, Emma Delves",False,Best Motion Picture of the Year,2019.0
61,Bohemian Rhapsody,7.9,2018,2h 14m,Bryan Singer,"Biografia, Drama, Musical","Anthony McCarten, Peter Morgan","Rami Malek, Lucy Boynton, Gwilym Lee, Ben Hardy, Joseph Mazzello",False,Best Motion Picture of the Year,2019.0
62,BlacKkKlansman,7.5,2018,2h 15m,Spike Lee,"Biografia, Comédia, Policial, Drama","Charlie Wachtel, David Rabinowitz, Kevin Willmott","John David Washington, Adam Driver, Laura Harrier, Topher Grace, Alec Baldwin",False,Best Motion Picture of the Year,2019.0
63,Black Panther,7.3,2018,2h 14m,Ryan Coogler,"Ação, Aventura, Ficção científica","Ryan Coogler, Joe Robert Cole, Stan Lee","Chadwick Boseman, Michael B. Jordan, Lupita Nyong'o, Danai Gurira, Martin Freeman",False,Best Motion Picture of the Year,2019.0
64,Green Book,8.2,2018,2h 10m,Peter Farrelly,"Biografia, Comédia, Drama, Musical","Nick Vallelonga, Brian Hayes Currie, Peter Farrelly","Viggo Mortensen, Mahershala Ali, Linda Cardellini, Sebastian Maniscalco, Dimiter D. Marinov",True,Best Motion Picture of the Year,2019.0
65,"Three Billboards Outside Ebbing, Missouri",8.1,2017,1h 55m,Martin McDonagh,"Comédia, Policial, Drama",Martin McDonagh,"Frances McDormand, Woody Harrelson, Sam Rockwell, Caleb Landry Jones, Kerry Condon",False,Best Motion Picture of the Year,2018.0
66,The Post,7.2,2017,1h 56m,Steven Spielberg,"Biografia, Drama, História, Suspense, Guerra","Liz Hannah, Josh Singer","Meryl Streep, Tom Hanks, Sarah Paulson, Bob Odenkirk, Tracy Letts",False,Best Motion Picture of the Year,2018.0
67,Phantom Thread,7.4,2017,2h 10m,Paul Thomas Anderson,"Drama, Romance",Paul Thomas Anderson,"Vicky Krieps, Daniel Day-Lewis, Lesley Manville, Julie Vollono, Sue Clark",False,Best Motion Picture of the Year,2018.0
68,Lady Bird,7.4,2017,1h 34m,Greta Gerwig,"Comédia, Drama",Greta Gerwig,"Saoirse Ronan, Laurie Metcalf, Tracy Letts, Lucas Hedges, Timothée Chalamet",False,Best Motion Picture of the Year,2018.0
69,Get Out,7.8,2017,1h 44m,Jordan Peele,"Terror, Mistério, Suspense",Jordan Peele,"Daniel Kaluuya, Allison Williams, Bradley Whitford, Catherine Keener, Caleb Landry Jones",False,Best Motion Picture of the Year,2018.0
70,Dunkirk,7.8,2017,1h 46m,Christopher Nolan,"Ação, Drama, História, Suspense, Guerra",Christopher Nolan,"Fionn Whitehead, Barry Keoghan, Mark Rylance, Tom Hardy, Damien Bonnard",False,Best Motion Picture of the Year,2018.0
71,Darkest Hour,7.4,2017,2h 5m,Joe Wright,"Biografia, Drama, História, Guerra",Anthony McCarten,"Gary Oldman, Lily James, Kristin Scott Thomas, Ben Mendelsohn, Ronald Pickup",False,Best Motion Picture of the Year,2018.0
72,Call Me by Your Name,7.8,2017,2h 12m,Luca Guadagnino,"Drama, Romance","James Ivory, André Aciman","Timothée Chalamet, Armie Hammer, Michael Stuhlbarg, Amira Casar, Esther Garrel",False,Best Motion Picture of the Year,2018.0
73,The Shape of Water,7.3,2017,2h 3m,Guillermo del Toro,"Drama, Fantasia, Romance, Ficção científica","Guillermo del Toro, Vanessa Taylor","Sally Hawkins, Octavia Spencer, Michael Shannon, Doug Jones, Richard Jenkins",True,Best Motion Picture of the Year,2018.0
74,Manchester by the Sea,7.8,2016,2h 17m,Kenneth Lonergan,Drama,Kenneth Lonergan,"Casey Affleck, Michelle Williams, Kyle Chandler, Lucas Hedges, Ivy O'Brien",False,Best Motion Picture of the Year,2017.0
75,Lion,8.0,2016,1h 58m,Garth Davis,"Biografia, Drama","Saroo Brierley, Luke Davies","Dev Patel, Nicole Kidman, Rooney Mara, Sunny Pawar, Abhishek Bharate",False,Best Motion Picture of the Year,2017.0
76,La La Land,8.0,2016,2h 8m,Damien Chazelle,"Comédia, Drama, Musical, Musical, Romance",Damien Chazelle,"Ryan Gosling, Emma Stone, Rosemarie DeWitt, J.K. Simmons, Amiee Conn",False,Best Motion Picture of the Year,2017.0
77,Hidden Figures,7.8,2016,2h 7m,Theodore Melfi,"Biografia, Drama, História","Allison Schroeder, Theodore Melfi, Margot Lee Shetterly","Taraji P. Henson, Octavia Spencer, Janelle Monáe, Kevin Costner, Kirsten Dunst",False,Best Motion Picture of the Year,2017.0
78,Hell or High Water,7.6,2016,1h 42m,David Mackenzie,"Policial, Drama, Suspense, Faroeste",Taylor Sheridan,"Chris Pine, Ben Foster, Jeff Bridges, Gil Birmingham, Dale Dickey",False,Best Motion Picture of the Year,2017.0
79,Hacksaw Ridge,8.1,2016,2h 19m,Mel Gibson,"Biografia, Drama, História, Guerra","Robert Schenkkan, Andrew Knight","Andrew Garfield, Sam Worthington, Luke Bracey, Teresa Palmer, Richard Pyros",False,Best Motion Picture of the Year,2017.0
80,Fences,7.2,2016,2h 19m,Denzel Washington,Drama,August Wilson,"Denzel Washington, Viola Davis, Stephen McKinley Henderson, Jovan Adepo, Russell Hornsby",False,Best Motion Picture of the Year,2017.0
81,Arrival,7.9,2016,1h 56m,Denis Villeneuve,"Drama, Mistério, Ficção científica","Eric Heisserer, Ted Chiang","Amy Adams, Jeremy Renner, Forest Whitaker, Michael Stuhlbarg, Mark O'Brien",False,Best Motion Picture of the Year,2017.0
82,Moonlight,7.4,2016,1h 51m,Barry Jenkins,Drama,"Barry Jenkins, Tarell Alvin McCraney","Mahershala Ali, Naomie Harris, Trevante Rhodes, Alex R. Hibbert, Shariff Earp",True,Best Motion Picture of the Year,2017.0
83,Room,8.1,2015,1h 58m,Lenny Abrahamson,"Drama, Suspense",Emma Donoghue,"Brie Larson, Jacob Tremblay, Sean Bridgers, Wendy Crewson, Sandy McMaster",False,Best Motion Picture of the Year,2016.0
84,The Revenant,8.0,2015,2h 36m,Alejandro G. Iñárritu,"Aventura, Drama, Faroeste","Mark L. Smith, Alejandro G. Iñárritu, Michael Punke","Leonardo DiCaprio, Tom Hardy, Will Poulter, Domhnall Gleeson, Forrest Goodluck",False,Best Motion Picture of the Year,2016.0
85,The Martian,8.0,2015,2h 24m,Ridley Scott,"Aventura, Drama, Ficção científica","Drew Goddard, Andy Weir","Matt Damon, Jessica Chastain, Kristen Wiig, Kate Mara, Jeff Daniels",False,Best Motion Picture of the Year,2016.0
86,Mad Max: Fury Road,8.1,2015,2h,George Miller,"Ação, Aventura, Ficção científica","George Miller, Brendan McCarthy, Nick Lathouris","Tom Hardy, Charlize Theron, Nicholas Hoult, Zoë Kravitz, Hugh Keays-Byrne",False,Best Motion Picture of the Year,2016.0
87,Brooklyn,7.5,2015,1h 57m,John Crowley,"Drama, Romance","Nick Hornby, Colm Tóibín","Saoirse Ronan, Emory Cohen, Domhnall Gleeson, Jim Broadbent, Hugh Gormley",False,Best Motion Picture of the Year,2016.0
88,Bridge of Spies,7.6,2015,2h 22m,Steven Spielberg,"Drama, História, Suspense, Guerra","Matt Charman, Ethan Coen, Joel Coen","Tom Hanks, Mark Rylance, Alan Alda, Amy Ryan, Domenick Lombardozzi",False,Best Motion Picture of the Year,2016.0
89,The Big Short,7.8,2015,2h 10m,Adam McKay,"Biografia, Comédia, Drama, História","Charles Randolph, Adam McKay, Michael Lewis","Christian Bale, Steve Carell, Ryan Gosling, Brad Pitt, Rudy Eisenzopf",False,Best Motion Picture of the Year,2016.0
90,Spotlight,8.1,2015,2h 9m,Tom McCarthy,"Biografia, Policial, Drama","Josh Singer, Tom McCarthy","Mark Ruffalo, Michael Keaton, Rachel McAdams, Liev Schreiber, John Slattery",True,Best Motion Picture of the Year,2016.0
91,Whiplash,8.5,2014,1h 46m,Damien Chazelle,"Drama, Musical",Damien Chazelle,"Miles Teller, J.K. Simmons, Melissa Benoist, Paul Reiser, Austin Stowell",False,Best Motion Picture of the Year,2015.0
92,American Sniper,7.3,2014,2h 13m,Clint Eastwood,"Ação, Biografia, Drama, Guerra","Jason Hall, Chris Kyle, Scott McEwen","Bradley Cooper, Sienna Miller, Kyle Gallner, Cole Konis, Ben Reed",False,Best Motion Picture of the Year,2015.0
93,Selma,7.5,2014,2h 8m,Ava DuVernay,"Biografia, Drama, História",Paul Webb,"David Oyelowo, Carmen Ejogo, Oprah Winfrey, Tom Wilkinson, Jim France",False,Best Motion Picture of the Year,2015.0
94,The Theory of Everything,7.7,2014,2h 3m,James Marsh,"Biografia, Drama, Romance","Anthony McCarten, Jane Hawking","Eddie Redmayne, Felicity Jones, Tom Prior, Sophie Perry, Finlay Wright-Stephens",False,Best Motion Picture of the Year,2015.0
95,The Imitation Game,8.0,2014,1h 54m,Morten Tyldum,"Biografia, Drama, Suspense, Guerra","Graham Moore, Andrew Hodges","Benedict Cumberbatch, Keira Knightley, Matthew Goode, Allen Leech, Rory Kinnear",False,Best Motion Picture of the Year,2015.0
96,The Grand Budapest Hotel,8.1,2014,1h 39m,Wes Anderson,"Comédia, Drama","Stefan Zweig, Wes Anderson, Hugo Guinness","Ralph Fiennes, F. Murray Abraham, Mathieu Amalric, Adrien Brody, Willem Dafoe",False,Best Motion Picture of the Year,2015.0
97,Boyhood,7.9,2014,2h 45m,Richard Linklater,Drama,Richard Linklater,"Ellar Coltrane, Patricia Arquette, Ethan Hawke, Elijah Smith, Lorelei Linklater",False,Best Motion Picture of the Year,2015.0
98,Birdman or (The Unexpected Virtue of Ignorance),7.7,2014,1h 59m,Alejandro G. Iñárritu,"Comédia, Drama","Alejandro G. Iñárritu, Nicolás Giacobone, Alexander Dinelaris","Michael Keaton, Zach Galifianakis, Edward Norton, Andrea Riseborough, Emma Stone",True,Best Motion Picture of the Year,2015.0
99,Philomena,7.6,2013,1h 38m,Stephen Frears,"Biografia, Comédia, Drama","Steve Coogan, Jeff Pope, Martin Sixsmith","Judi Dench, Steve Coogan, Sophie Kennedy Clark, Mare Winningham, Barbara Jefford",False,Best Motion Picture of the Year,2014.0
100,Nebraska,7.7,2013,1h 55m,Alexander Payne,Drama,Bob Nelson,"Bruce Dern, Will Forte, June Squibb, Bob Odenkirk, Stacy Keach",False,Best Motion Picture of the Year,2014.0
101,Captain Phillips,7.8,2013,2h 14m,Paul Greengrass,"Ação, Biografia, Policial, Drama, Suspense","Billy Ray, Richard Phillips, Stephan Talty","Tom Hanks, Barkhad Abdi, Barkhad Abdirahman, Catherine Keener, Faysal Ahmed",False,Best Motion Picture of the Year,2014.0
102,Her,8.0,2013,2h 6m,Spike Jonze,"Drama, Romance, Ficção científica",Spike Jonze,"Joaquin Phoenix, Amy Adams, Scarlett Johansson, Rooney Mara, Lynn Adrianna Freedman",False,Best Motion Picture of the Year,2014.0
103,Dallas Buyers Club,7.9,2013,1h 57m,Jean-Marc Vallée,"Biografia, Drama","Craig Borten, Melisa Wallack","Matthew McConaughey, Jennifer Garner, Jared Leto, Steve Zahn, Denis O'Hare",False,Best Motion Picture of the Year,2014.0
104,The Wolf of Wall Street,8.2,2013,3h,Martin Scorsese,"Biografia, Comédia, Policial, Drama","Terence Winter, Jordan Belfort","Leonardo DiCaprio, Jonah Hill, Margot Robbie, Matthew McConaughey, Kyle Chandler",False,Best Motion Picture of the Year,2014.0
105,Gravity,7.7,2013,1h 31m,Alfonso Cuarón,"Drama, Ficção científica, Suspense","Alfonso Cuarón, Jonás Cuarón","Sandra Bullock, George Clooney, Ed Harris, Orto Ignatiussen, Phaldut Sharma",False,Best Motion Picture of the Year,2014.0
106,American Hustle,7.2,2013,2h 18m,David O. Russell,"Policial, Drama","Eric Warren Singer, David O. Russell","Christian Bale, Amy Adams, Bradley Cooper, Jennifer Lawrence, Jeremy Renner",False,Best Motion Picture of the Year,2014.0
107,12 Years a Slave,8.1,2013,2h 14m,Steve McQueen,"Biografia, Drama, História","John Ridley, Solomon Northup","Chiwetel Ejiofor, Michael Kenneth Williams, Michael Fassbender, Brad Pitt, Dwight Henry",True,Best Motion Picture of the Year,2014.0
