#,título,nota_imdb,ano,duração,direção,gêneros,roteiro,elenco_principal,vencedor
135,Winter's Bone,7.1,2010,1h 40m,Debra Granik,"Drama, Mistério, Policial, Suspense","Debra Granik, Anne Rosellini, Daniel Woodrell","Jennifer Lawrence, John Hawkes, Garret Dillahunt, Isaiah Stone, Ashlee Thompson",False
136,A Serious Man,7.0,2009,1h 46m,"Ethan Coen, Joel Coen","Comédia, Drama","Joel Coen, Ethan Coen","Michael Stuhlbarg, Richard Kind, Sari Lennick, Fred Melamed, Aaron Wolff",False
137,An Education,7.2,2009,1h 40m,Lone Scherfig,Drama,"Lynn Barber, Nick Hornby","Carey Mulligan, Peter Sarsgaard, Alfred Molina, Olivia Williams, Cara Seymour",False
138,Avatar,7.9,2009,2h 42m,James Cameron,"Aventura, Ação, Fantasia, Ficção científica",James Cameron,"Sam Worthington, Zoe Saldana, Sigourney Weaver, Michelle Rodriguez, Stephen Lang",False
139,District 9,7.9,2009,1h 52m,Neill Blomkamp,"Ação, Ficção científica, Suspense","Neill Blomkamp, Terri Tatchell","Sharlto Copley, David James, Jason Cope, Nathalie Boltt, Sylvaine Strike",False
140,Inglourious Basterds,8.4,2009,2h 33m,Quentin Tarantino,"Aventura, Drama, Guerra",Quentin Tarantino,"Brad Pitt, Diane Kruger, Eli Roth, Mélanie Laurent, Christoph Waltz",False
141,Precious,7.3,2009,1h 50m,Lee Daniels,Drama,"Geoffrey Fletcher, Sapphire","Gabourey Sidibe, Mo'Nique, Paula Patton, Mariah Carey, Sherri Shepherd",False
142,The Blind Side,7.6,2009,2h 9m,John Lee Hancock,"Biografia, Drama, Esportes","John Lee Hancock, Michael Lewis","Quinton Aaron, Sandra Bullock, Tim McGraw, Jae Head, Lily Collins",False
143,Up,8.3,2009,1h 36m,"Pete Docter, Bob Peterson","Animação, Aventura, Comédia, Drama, Família","Pete Docter, Bob Peterson, Tom McCarthy","Edward Asner, Jordan Nagai, John Ratzenberger, Christopher Plummer, Bob Peterson",False
144,Up in the Air,7.4,2009,1h 49m,Jason Reitman,"Comédia, Drama, Romance","Walter Kirn, Jason Reitman, Sheldon Turner","George Clooney, Vera Farmiga, Anna Kendrick, Jason Bateman, Amy Morton",False
145,Slumdog Millionaire,8.0,2008,2h,"Danny Boyle, Loveleen Tandan","Drama, Policial, Romance","Simon Beaufoy, Vikas Swarup","Dev Patel, Freida Pinto, Saurabh Shukla, Anil Kapoor, Raj Zutshi",True
146,The Hurt Locker,7.5,2008,2h 11m,Kathryn Bigelow,"Drama, Guerra, Suspense",Mark Boal,"Jeremy Renner, Anthony Mackie, Brian Geraghty, Guy Pearce, Ralph Fiennes",True
147,Frost/Nixon,7.6,2008,2h 2m,Ron Howard,"Biografia, Drama, História",Peter Morgan,"Frank Langella, Michael Sheen, Kevin Bacon, Sam Rockwell, Matthew Macfadyen",False
148,Milk,7.5,2008,2h 8m,Gus Van Sant,"Biografia, Drama, História",Dustin Lance Black,"Sean Penn, Josh Brolin, Emile Hirsch, Diego Luna, James Franco",False
149,The Curious Case of Benjamin Button,7.8,2008,2h 46m,David Fincher,"Drama, Fantasia, Romance","Eric Roth, Robin Swicord, F. Scott Fitzgerald","Brad Pitt, Cate Blanchett, Tilda Swinton, Julia Ormond, Faune Chambers Watkins",False
150,The Reader,7.6,2008,2h 4m,Stephen Daldry,"Drama, Mistério, Romance","David Hare, Bernhard Schlink","Kate Winslet, Ralph Fiennes, Bruno Ganz, Jeanette Hain, David Kross",False
151,No Country for Old Men,8.2,2007,2h 2m,"Ethan Coen, Joel Coen","Drama, Policial, Suspense","Joel Coen, Ethan Coen, Cormac McCarthy","Tommy Lee Jones, Javier Bardem, Josh Brolin, Woody Harrelson, Kelly Macdonald",True
152,Atonement,7.8,2007,2h 3m,Joe Wright,"Drama, Guerra, Mistério, Romance","Ian McEwan, Christopher Hampton","Keira Knightley, James McAvoy, Brenda Blethyn, Saoirse Ronan, Ailidh Mackay",False
153,Juno,7.4,2007,1h 36m,Jason Reitman,"Comédia, Drama",Diablo Cody,"Elliot Page, Michael Cera, Jennifer Garner, Jason Bateman, Allison Janney",False
154,Michael Clayton,7.2,2007,1h 59m,Tony Gilroy,"Drama, Mistério, Policial, Suspense",Tony Gilroy,"George Clooney, Tilda Swinton, Tom Wilkinson, Michael O'Keefe, Sydney Pollack",False
155,There Will Be Blood,8.2,2007,2h 38m,Paul Thomas Anderson,Drama,"Paul Thomas Anderson, Upton Sinclair","Daniel Day-Lewis, Paul Dano, Ciarán Hinds, Martin Stringer, Matthew Braden Stringer",False
156,The Departed,8.5,2006,2h 31m,Martin Scorsese,"Drama, Policial, Suspense","William Monahan, Alan Mak, Felix Chong","Leonardo DiCaprio, Matt Damon, Jack Nicholson, Mark Wahlberg, Martin Sheen",True
157,Babel,7.5,2006,2h 23m,Alejandro G. Iñárritu,Drama,"Guillermo Arriaga, Alejandro G. Iñárritu","Brad Pitt, Cate Blanchett, Gael García Bernal, Mohamed Akhzam, Peter Wight",False
158,Letters from Iwo Jima,7.8,2006,2h 21m,Clint Eastwood,"Aventura, Ação, Drama, Guerra, História","Iris Yamashita, Paul Haggis, Tadamichi Kuribayashi","Ken Watanabe, Kazunari Ninomiya, Tsuyoshi Ihara, Ryô Kase, Shidô Nakamura",False
159,Little Miss Sunshine,7.8,2006,1h 41m,"Jonathan Dayton, Valerie Faris","Comédia, Drama",Michael Arndt,"Steve Carell, Toni Collette, Greg Kinnear, Abigail Breslin, Paul Dano",False
160,The Queen,7.3,2006,1h 43m,Stephen Frears,"Biografia, Drama",Peter Morgan,"Helen Mirren, Michael Sheen, James Cromwell, Alex Jennings, Roger Allam",False
161,Brokeback Mountain,7.7,2005,2h 14m,Ang Lee,"Drama, Romance","Annie Proulx, Larry McMurtry, Diana Ossana","Jake Gyllenhaal, Heath Ledger, Michelle Williams, Randy Quaid, Valerie Planche",False
162,Capote,7.3,2005,1h 54m,Bennett Miller,"Biografia, Drama, História, Policial","Dan Futterman, Gerald Clarke","Philip Seymour Hoffman, Clifton Collins Jr., Catherine Keener, Allie Mickelson, Kelci Stephenson",False
163,"Good Night, and Good Luck.",7.4,2005,1h 33m,George Clooney,"Biografia, Drama, História","George Clooney, Grant Heslov","David Strathairn, George Clooney, Patricia Clarkson, Jeff Daniels, Alex Borstein",False
164,Munich,7.5,2005,2h 44m,Steven Spielberg,"Drama, História, Suspense","Tony Kushner, Eric Roth, George Jonas","Eric Bana, Daniel Craig, Marie-Josée Croze, Ciarán Hinds, Mathieu Kassovitz",False
165,Crash,7.7,2004,1h 52m,Paul Haggis,"Drama, Policial, Suspense","Paul Haggis, Bobby Moresco","Don Cheadle, Sandra Bullock, Thandiwe Newton, Karina Arroyave, Dato Bakhtadze",True
166,Million Dollar Baby,8.1,2004,2h 12m,Clint Eastwood,"Drama, Esportes","Paul Haggis, F.X. Toole","Hilary Swank, Clint Eastwood, Morgan Freeman, Jay Baruchel, Mike Colter",True
167,Finding Neverland,7.6,2004,1h 46m,Marc Forster,"Biografia, Drama, Família","Allan Knee, David Magee","Johnny Depp, Kate Winslet, Julie Christie, Radha Mitchell, Dustin Hoffman",False
168,Ray,7.7,2004,2h 32m,Taylor Hackford,"Biografia, Drama, Musical","Taylor Hackford, James L. White","Jamie Foxx, Regina King, Kerry Washington, Clifton Powell, Harry Lennix",False
169,Sideways,7.5,2004,2h 7m,Alexander Payne,"Comédia, Drama, Romance","Rex Pickett, Alexander Payne, Jim Taylor","Paul Giamatti, Thomas Haden Church, Virginia Madsen, Sandra Oh, Marylouise Burke",False
170,The Aviator,7.5,2004,2h 50m,Martin Scorsese,"Biografia, Drama",John Logan,"Leonardo DiCaprio, Cate Blanchett, Kate Beckinsale, John C. Reilly, Alec Baldwin",False
171,Master and Commander: The Far Side of the World,7.5,2003,2h 18m,Peter Weir,"Aventura, Ação, Drama, Guerra","Patrick O'Brian, Peter Weir, John Collee","Russell Crowe, Paul Bettany, Billy Boyd, James D'Arcy, Edward Woodall",True
172,Mystic River,7.9,2003,2h 18m,Clint Eastwood,"Drama, Mistério, Policial, Suspense",Brian Helgeland,"Sean Penn, Tim Robbins, Kevin Bacon, Laurence Fishburne, Marcia Gay Harden",True
173,Seabiscuit,7.3,2003,2h 20m,Gary Ross,"Drama, Esportes, História","Fran Walsh, Philippa Boyens, Peter Jackson","Elijah Wood, Viggo Mortensen, Ian McKellen, Orlando Bloom, Sean Astin",True
174,The Lord of the Rings: The Return of the King,9.0,2003,3h 21m,Peter Jackson,"Aventura, Drama, Fantasia","Fran Walsh, Philippa Boyens, Peter Jackson","Elijah Wood, Viggo Mortensen, Ian McKellen, Orlando Bloom, Sean Astin",True
175,Lost in Translation,7.7,2003,1h 42m,Sofia Coppola,"Comédia, Drama",Sofia Coppola,"Bill Murray, Scarlett Johansson, Giovanni Ribisi, Anna Faris, Fumihiro Hayashi",False
176,Chicago,7.2,2002,1h 53m,Rob Marshall,"Comédia, Musical, Policial","Bill Condon, Bob Fosse, Fred Ebb","Renée Zellweger, Catherine Zeta-Jones, Richard Gere, Taye Diggs, Cliff Saunders",False
177,Gangs of New York,7.5,2002,2h 47m,Martin Scorsese,"Drama, Policial","Fran Walsh, Philippa Boyens, Peter Jackson","Elijah Wood, Viggo Mortensen, Ian McKellen, Orlando Bloom, Bernard Hill",False
178,The Hours,7.5,2002,1h 50m,Stephen Daldry,"Drama, Romance",David Hare,"Nicole Kidman, Meryl Streep, Julianne Moore, Ed Harris, John C. Reilly",False
179,The Lord of the Rings: The Two Towers,8.8,2002,2h 59m,Peter Jackson,"Aventura, Drama, Fantasia","Fran Walsh, Philippa Boyens, Peter Jackson","Elijah Wood, Viggo Mortensen, Ian McKellen, Orlando Bloom, Bernard Hill",False
180,The Pianist,8.5,2002,2h 30m,Roman Polanski,"Biografia, Drama, Guerra, Musical","Ronald Harwood, Wladyslaw Szpilman","Adrien Brody, Thomas Kretschmann, Frank Finlay, Emilia Fox, Michal Zebrowski",False
181,A Beautiful Mind,8.2,2001,2h 15m,Ron Howard,"Biografia, Drama, Mistério",Akiva Goldsman,"Russell Crowe, Jennifer Connelly, Ed Harris, Paul Bettany, Christopher Plummer",True
182,Moulin Rouge!,7.6,2001,2h 7m,Baz Luhrmann,"Drama, Musical, Romance",Akiva Goldsman,"Russell Crowe, Jennifer Connelly, Ed Harris, Paul Bettany, Christopher Plummer",True
183,The Lord of the Rings: The Fellowship of the Ring,8.9,2001,2h 58m,Peter Jackson,"Aventura, Drama, Fantasia","J.R.R. Tolkien, Fran Walsh, Philippa Boyens","Elijah Wood, Ian McKellen, Orlando Bloom, Sean Bean, Alan Howard",True
184,Gosford Park,7.2,2001,2h 17m,Robert Altman,"Comédia, Drama, Mistério","Todd Field, Robert Festinger","Sissy Spacek, Tom Wilkinson, Marisa Tomei, Nick Stahl, William Mapother",False
185,In the Bedroom,7.4,2001,2h 11m,Todd Field,"Drama, Policial",Julian Fellowes,"Maggie Smith, Michael Gambon, Kristin Scott Thomas, Helen Mirren, Clive Owen",False
186,Traffic,7.5,2000,2h 27m,Steven Soderbergh,"Drama, Policial, Suspense",Stephen Gaghan,"Michael Douglas, Benicio Del Toro, Catherine Zeta-Jones, Dennis Quaid, Don Cheadle",True
187,Chocolat,7.2,2000,2h 1m,Lasse Hallström,"Drama, Romance",Susannah Grant,"Julia Roberts, Albert Finney, Aaron Eckhart, Marg Helgenberger, Peter Coyote",False
188,"Crouching Tiger, Hidden Dragon",7.9,2000,2h,Ang Lee,"Aventura, Ação, Drama, Fantasia, Romance","James Schamus, Hui-Ling Wang, Kuo Jung Tsai","Chow Yun-fat, Michelle Yeoh, Zhang Ziyi, Chang Chen, Sihung Lung",False
189,Erin Brockovich,7.5,2000,2h 11m,Steven Soderbergh,"Biografia, Drama",Robert Nelson Jacobs,"Juliette Binoche, Johnny Depp, Judi Dench, Alfred Molina, Lena Olin",False
190,Gladiator,8.5,2000,2h 35m,Ridley Scott,"Aventura, Ação, Drama","David Franzoni, John Logan, William Nicholson","Russell Crowe, Joaquin Phoenix, Connie Nielsen, Oliver Reed, Richard Harris",False
191,American Beauty,8.3,1999,2h 2m,Sam Mendes,Drama,M. Night Shyamalan,"Bruce Willis, Haley Joel Osment, Toni Collette, Olivia Williams, Donnie Wahlberg",False
192,The Cider House Rules,7.4,1999,2h 6m,Lasse Hallström,"Drama, Romance",John Irving,"Tobey Maguire, Charlize Theron, Michael Caine, Delroy Lindo, Paul Rudd",False
193,The Green Mile,8.6,1999,3h 9m,Frank Darabont,"Drama, Fantasia, Mistério, Policial",Frank Darabont,"Tom Hanks, Michael Clarke Duncan, David Morse, Bonnie Hunt, James Cromwell",False
194,The Insider,7.8,1999,2h 37m,Michael Mann,"Biografia, Drama, História, Suspense",John Irving,"Tobey Maguire, Charlize Theron, Michael Caine, Delroy Lindo, Paul Rudd",False
195,The Sixth Sense,8.2,1999,1h 47m,M. Night Shyamalan,"Drama, Mistério, Suspense",M. Night Shyamalan,"Bruce Willis, Haley Joel Osment, Toni Collette, Olivia Williams, Donnie Wahlberg",False
196,Saving Private Ryan,8.6,1998,2h 49m,Steven Spielberg,"Drama, Guerra",Robert Rodat,"Tom Hanks, Matt Damon, Tom Sizemore, Edward Burns, Barry Pepper",True
197,Elizabeth,7.4,1998,2h 4m,Shekhar Kapur,"Biografia, Drama, História",Michael Hirst,"Cate Blanchett, Liz Giles, Rod Culbertson, Paul Fox, Terence Rigby",False
198,Life Is Beautiful,7.1,1998,2h 3m,John Madden,"Comédia, Drama, História, Romance","Roberto Benigni, Vincenzo Cerami","Roberto Benigni, Nicoletta Braschi, Giorgio Cantarini, Giustino Durano, Marisa Paredes",False
199,The Thin Red Line,7.6,1998,2h 50m,Terrence Malick,"Drama, Guerra, História","James Jones, Terrence Malick","Jim Caviezel, Sean Penn, Nick Nolte, Kirk Acevedo, Penelope Allen",False
200,Titanic,7.9,1997,3h 14m,James Cameron,"Drama, Romance",James Cameron,"Leonardo DiCaprio, Kate Winslet, Billy Zane, Kathy Bates, Frances Fisher",True
201,As Good as It Gets,7.7,1997,2h 19m,James L. Brooks,"Comédia, Drama, Romance","Mark Andrus, James L. Brooks","Jack Nicholson, Helen Hunt, Greg Kinnear, Cuba Gooding Jr., Skeet Ulrich",False
202,Good Will Hunting,8.3,1997,2h 6m,Gus Van Sant,"Drama, Romance","Matt Damon, Ben Affleck","Matt Damon, Robin Williams, Ben Affleck, Minnie Driver, Stellan Skarsgård",False
203,L.A. Confidential,8.2,1997,2h 18m,Curtis Hanson,"Drama, Mistério, Policial, Suspense",Simon Beaufoy,"Robert Carlyle, Tom Wilkinson, Mark Addy, Steve Huison, William Snape",False
204,Life Is Beautiful,8.6,1997,1h 56m,Roberto Benigni,"Comédia, Drama, Guerra, Romance","Mark Andrus, James L. Brooks","Jack Nicholson, Helen Hunt, Greg Kinnear, Cuba Gooding Jr., Skeet Ulrich",False
205,The Full Monty,7.2,1997,1h 31m,Peter Cattaneo,"Comédia, Drama",Simon Beaufoy,"Robert Carlyle, Tom Wilkinson, Mark Addy, Steve Huison, William Snape",False
206,Fargo,8.1,1996,1h 38m,"Joel Coen, Ethan Coen","Drama, Policial, Suspense",Mike Leigh,"Brenda Blethyn, Marianne Jean-Baptiste, Timothy Spall, Claire Rushbrook, Philip Glenister",False
207,Jerry Maguire,7.3,1996,2h 19m,Cameron Crowe,"Comédia, Drama, Esportes, Romance",Cameron Crowe,"Tom Cruise, Renée Zellweger, Cuba Gooding Jr., Kelly Preston, Jerry O'Connell",False
208,Secrets & Lies,8.0,1996,2h 16m,Mike Leigh,"Comédia, Drama",Mike Leigh,"Brenda Blethyn, Marianne Jean-Baptiste, Timothy Spall, Claire Rushbrook, Philip Glenister",False
209,Shine,7.6,1996,1h 45m,Scott Hicks,"Biografia, Drama, Musical, Romance",Jan Sardi,"Geoffrey Rush, Alex Rafalowicz, Lynn Redgrave, Armin Mueller-Stahl, John Gaden",False
210,The English Patient,7.4,1996,2h 42m,Anthony Minghella,"Drama, Guerra, Romance",Jan Sardi,"Geoffrey Rush, Alex Rafalowicz, Lynn Redgrave, Armin Mueller-Stahl, John Gaden",False
211,Braveheart,8.3,1995,2h 58m,Mel Gibson,"Biografia, Drama, Guerra",Randall Wallace,"Mel Gibson, Sophie Marceau, Patrick McGoohan, Angus Macfadyen, James Robinson",True
212,Babe,6.9,1995,1h 31m,Chris Noonan,"Comédia, Drama, Família","George Miller, Chris Noonan","James Cromwell, Magda Szubanski, Christine Cavanaugh, Miriam Margolyes, Danny Mann",False
213,Sense and Sensibility,7.7,1995,2h 16m,Ang Lee,"Drama, Romance","William Broyles Jr., Al Reinert","Tom Hanks, Kevin Bacon, Bill Paxton, Gary Sinise, Ed Harris",False
214,The Postman,7.7,1995,2h 20m,Ron Howard,"Aventura, Drama, História",Eric Roth,"Kevin Costner, Will Patton, Larenz Tate, Olivia Williams, Phil Prescott",False
215,Forrest Gump,8.8,1994,2h 22m,Robert Zemeckis,"Drama, Romance","Winston Groom, Eric Roth","Tom Hanks, Robin Wright, Gary Sinise, Sally Field, Rebecca Williams",False
216,Four Weddings and a Funeral,7.1,1994,1h 57m,Mike Newell,"Comédia, Drama, Romance",Richard Curtis,"Hugh Grant, Andie MacDowell, Kristin Scott Thomas, Simon Callow, John Hannah",False
217,Pulp Fiction,8.8,1994,2h 34m,Quentin Tarantino,"Drama, Policial","Paul Attanasio, Richard N. Goodwin","Ralph Fiennes, John Turturro, Rob Morrow, David Paymer, Paul Scofield",False
218,Quiz Show,7.5,1994,2h 13m,Robert Redford,"Biografia, Drama, História","Quentin Tarantino, Roger Avary","John Travolta, Uma Thurman, Samuel L. Jackson, Bruce Willis, Harvey Keitel",False
219,The Postman,7.8,1994,1h 48m,Michael Radford,"Biografia, Comédia, Drama, Romance",Richard Curtis,"Hugh Grant, Andie MacDowell, Kristin Scott Thomas, Simon Callow, John Hannah",False
220,The Shawshank Redemption,9.3,1994,2h 22m,Frank Darabont,Drama,"Stephen King, Frank Darabont","Tim Robbins, Morgan Freeman, Bob Gunton, William Sadler, Clancy Brown",False
221,In the Name of the Father,8.1,1993,2h 13m,Jim Sheridan,"Biografia, Drama, Policial",Terry George,"Daniel Day-Lewis, Pete Postlethwaite, Emma Thompson, Corin Redgrave, Beatie Edney",False
222,Schindler's List,9.0,1993,3h 15m,Steven Spielberg,"Biografia, Drama, História",Ruth Prawer Jhabvala,"Anthony Hopkins, Emma Thompson, James Fox, Christopher Reeve, Hugh Grant",False
223,The Fugitive,7.8,1993,2h 10m,Andrew Davis,"Ação, Drama, Mistério, Policial, Suspense",Terry George,"Daniel Day-Lewis, Pete Postlethwaite, Emma Thompson, Corin Redgrave, Beatie Edney",False
224,The Piano,7.5,1993,2h 1m,Jane Campion,"Drama, Musical, Romance",Jane Campion,"Holly Hunter, Harvey Keitel, Sam Neill, Anna Paquin, Kerry Walker",False
225,The Remains of the Day,7.8,1993,2h 14m,James Ivory,"Drama, Romance",Ruth Prawer Jhabvala,"Anthony Hopkins, Emma Thompson, James Fox, Christopher Reeve, Hugh Grant",False
226,A Few Good Men,7.7,1992,2h 18m,Rob Reiner,"Drama, Suspense",Bo Goldman,"Al Pacino, Chris O'Donnell, Philip Seymour Hoffman, Gabrielle Anwar, James Rebhorn",False
227,Howards End,7.4,1992,2h 22m,James Ivory,"Drama, Romance","E.M. Forster, Ruth Prawer Jhabvala","Anthony Hopkins, Emma Thompson, Vanessa Redgrave, Helena Bonham Carter, Joseph Bennett",False
228,Scent of a Woman,8.0,1992,2h 36m,Martin Brest,Drama,Aaron Sorkin,"Tom Cruise, Jack Nicholson, Demi Moore, Kevin Bacon, Kiefer Sutherland",False
229,The Crying Game,7.2,1992,1h 52m,Neil Jordan,"Drama, Policial, Romance, Suspense",Neil Jordan,"Stephen Rea, Forest Whitaker, Miranda Richardson, Jaye Davidson, Adrian Dunbar",False
230,Unforgiven,8.2,1992,2h 10m,Clint Eastwood,"Drama, Faroeste",David Webb Peoples,"Clint Eastwood, Gene Hackman, Morgan Freeman, Richard Harris, Jaimz Woolvett",False
231,JFK,8.0,1991,3h 9m,Oliver Stone,"Drama, História, Suspense","Jim Garrison, Jim Marrs, Oliver Stone","Kevin Costner, Gary Oldman, Jack Lemmon, Walter Matthau, Sally Kirkland",True
232,The Prince of Tides,6.8,1991,2h 12m,Barbra Streisand,"Drama, Romance",Ted Tally,"Jodie Foster, Anthony Hopkins, Scott Glenn, Ted Levine, Anthony Heald",True
233,The Silence of the Lambs,8.6,1991,1h 58m,Jonathan Demme,"Drama, Policial, Suspense, Terror",Ted Tally,"Jodie Foster, Anthony Hopkins, Scott Glenn, Ted Levine, Anthony Heald",True
234,Beauty and the Beast,8.0,1991,1h 24m,"Gary Trousdale, Kirk Wise","Animação, Família, Fantasia, Musical, Romance",Linda Woolverton,"Paige O’Hara, Robby Benson, Richard White, Jerry Orbach, Angela Lansbury",False
235,Bugsy,6.8,1991,2h 16m,Barry Levinson,"Biografia, Drama, Policial",Linda Woolverton,"Paige O’Hara, Robby Benson, Richard White, Jerry Orbach, Angela Lansbury",False
236,Awakenings,7.8,1990,2h 1m,Penny Marshall,"Biografia, Drama",Steven Zaillian,"Robin Williams, Robert De Niro, Julie Kavner, Ruth Nelson, John Heard",False
237,Dances with Wolves,8.0,1990,3h 1m,Kevin Costner,"Aventura, Drama, Faroeste","Nicholas Pileggi, Martin Scorsese","Robert De Niro, Ray Liotta, Joe Pesci, Lorraine Bracco, Paul Sorvino",False
238,Ghost,7.1,1990,2h 6m,Jerry Zucker,"Drama, Fantasia, Romance, Suspense",Bruce Joel Rubin,"Patrick Swayze, Demi Moore, Whoopi Goldberg, Tony Goldwyn, Rick Aviles",False
239,GoodFellas,8.7,1990,2h 25m,Martin Scorsese,"Biografia, Drama, Policial",Steven Zaillian,"Robin Williams, Robert De Niro, Julie Kavner, Ruth Nelson, John Heard",False
240,The Godfather Part III,7.6,1990,2h 42m,Francis Ford Coppola,"Drama, Policial","Mario Puzo, Francis Ford Coppola","Al Pacino, Diane Keaton, Andy Garcia, Talia Shire, Eli Wallach",False
241,My Left Foot: The Story of Christy Brown,7.8,1989,1h 43m,Jim Sheridan,"Biografia, Drama",Alfred Uhry,"Jessica Tandy, Morgan Freeman, Dan Aykroyd, Patti LuPone, Joann Havrilla",True
242,Born on the Fourth of July,7.2,1989,2h 25m,Oliver Stone,"Biografia, Drama, Guerra",Phil Alden Robinson,"Kevin Costner, Amy Madigan, James Earl Jones, Ray Liotta, Burt Lancaster",False
243,Dead Poets Society,8.1,1989,2h 8m,Peter Weir,"Comédia, Drama",Tom Schulman,"Robin Williams, Robert Sean Leonard, Ethan Hawke, Josh Charles, Gale Hansen",False
244,Driving Miss Daisy,7.3,1989,1h 39m,Bruce Beresford,"Comédia, Drama","Shane Connaughton, Jim Sheridan","Daniel Day-Lewis, Brenda Fricker, Ray McAnally, Fiona Shaw, Hugh O’Conor",False
245,Field of Dreams,7.5,1989,1h 47m,Phil Alden Robinson,"Drama, Esportes, Família, Fantasia",Phil Alden Robinson,"Kevin Costner, Amy Madigan, James Earl Jones, Ray Liotta, Burt Lancaster",False
246,Dangerous Liaisons,7.5,1988,1h 59m,Stephen Frears,"Drama, Romance",Christopher Hampton,"Glenn Close, John Malkovich, Michelle Pfeiffer, Swoosie Kurtz, Keanu Reeves",False
247,Mississippi Burning,7.8,1988,2h 8m,Alan Parker,"Drama, Mistério, Policial, Suspense","Kevin Wade, Mike Nichols","Melanie Griffith, Harrison Ford, Sigourney Weaver, Alec Baldwin, Joan Cusack",False
248,Rain Man,8.0,1988,2h 13m,Barry Levinson,Drama,Christopher Hampton,"Glenn Close, John Malkovich, Michelle Pfeiffer, Swoosie Kurtz, Keanu Reeves",False
249,The Accidental Tourist,6.7,1988,2h 1m,Lawrence Kasdan,"Comédia, Drama, Romance",Frank Galati,"William Hurt, Geena Davis, Kathleen Turner, Jeff Daniels, George Plimpton",False
250,Working Girl,6.8,1988,1h 53m,Mike Nichols,"Comédia, Drama, Romance","Kevin Wade, Mike Nichols","Melanie Griffith, Harrison Ford, Sigourney Weaver, Alec Baldwin, Joan Cusack",False
251,Broadcast News,7.3,1987,2h 13m,James L. Brooks,"Comédia, Drama, Romance",James L. Brooks,"William Hurt, Albert Brooks, Holly Hunter, Robert Prosky, Lois Chiles",False
252,Fatal Attraction,6.9,1987,1h 59m,Adrian Lyne,"Drama, Suspense",James Dearden,"Michael Douglas, Glenn Close, Anne Archer, Ellen Latzen, Stuart Pankin",False
253,Hope and Glory,7.3,1987,1h 53m,John Boorman,"Comédia, Drama, Romance",John Boorman,"Sarah Miles, David Hayman, Sebastian Rice-Edwards, Geraldine Muir, Sammi Davis",False
254,Moonstruck,7.2,1987,1h 42m,Norman Jewison,"Comédia, Drama, Romance",John Patrick Shanley,"Cher, Nicolas Cage, Olympia Dukakis, Vincent Gardenia, Danny Aiello",False
255,The Last Emperor,7.7,1987,2h 43m,Bernardo Bertolucci,"Biografia, Drama, História",John Patrick Shanley,"Cher, Nicolas Cage, Olympia Dukakis, Vincent Gardenia, Danny Aiello",False
256,The Mission,7.4,1986,2h 5m,Roland Joffé,"Aventura, Drama, História",Robert Bolt,"Robert De Niro, Jeremy Irons, Ray McAnally, Aidan Quinn, Cherie Lunghi",True
257,Children of a Lesser God,7.2,1986,1h 59m,Randa Haines,"Drama, Romance","Hesper Anderson, Mark Medoff","Marlee Matlin, William Hurt, Piper Laurie, Philip Bosco, John Rubinstein",False
258,Hannah and Her Sisters,7.8,1986,1h 47m,Woody Allen,"Comédia, Drama",Woody Allen,"Woody Allen, Mia Farrow, Michael Caine, Dianne Wiest, Barbara Hershey",False
259,Platoon,8.1,1986,2h,Oliver Stone,"Drama, Guerra","Hesper Anderson, Mark Medoff","Marlee Matlin, William Hurt, Piper Laurie, Philip Bosco, John Rubinstein",False
260,Out of Africa,7.1,1985,2h 41m,Sydney Pollack,"Biografia, Drama, Romance","Karen Blixen, Judith Thurman, Errol Trzebinski","Meryl Streep, Robert Redford, Klaus Maria Brandauer, Michael Kitchen, Malick Bowens",True
261,A Room with a View,7.2,1985,1h 57m,James Ivory,"Drama, Romance","E.M. Forster, Ruth Prawer Jhabvala","Maggie Smith, Helena Bonham Carter, Denholm Elliott, Julian Sands, Simon Callow",False
262,Kiss of the Spider Woman,7.3,1985,2h,Hector Babenco,Drama,"Richard Condon, Janet Roach","Jack Nicholson, Kathleen Turner, Anjelica Huston, Robert Loggia, William Hickey",False
263,Prizzi's Honor,6.7,1985,2h 10m,John Huston,"Comédia, Drama, Policial, Romance",Leonard Schrader,"William Hurt, Raul Julia, Sônia Braga, José Lewgoy, Milton Gonçalves",False
264,The Color Purple,7.7,1985,2h 34m,Steven Spielberg,Drama,"Menno Meyjes, Alice Walker","Danny Glover, Whoopi Goldberg, Oprah Winfrey, Margaret Avery, Willard E. Pugh",False
265,Witness,7.3,1985,1h 52m,Peter Weir,"Drama, Policial, Romance, Suspense","William Kelley, Pamela Wallace, Earl W. Wallace","Harrison Ford, Kelly McGillis, Lukas Haas, Josef Sommer, Jan Rubes",False
266,The Killing Fields,7.8,1984,2h 21m,Roland Joffé,"Biografia, Drama, Guerra, História",John Crowley,"Sally Field, Robert Drivas, John Malkovich, Ed Harris, Lindsay Crouse",True
267,A Passage to India,7.3,1984,2h 44m,David Lean,"Aventura, Drama, História","E.M. Forster, Santha Rama Rau, David Lean","Judy Davis, Victor Banerjee, Peggy Ashcroft, James Fox, Alec Guinness",False
268,A Soldier's Story,7.2,1984,1h 41m,Norman Jewison,"Drama, Guerra, Mistério, Policial",Charles Fuller,"Howard E. Rollins Jr., Adolph Caesar, David Alan Grier, Art Evans, Denzel Washington",False
269,Amadeus,8.4,1984,2h 40m,Milos Forman,"Biografia, Drama, Musical","Peter Shaffer, Zdenek Mahler","F. Murray Abraham, Tom Hulce, Elizabeth Berridge, Roy Dotrice, Simon Callow",False
270,Places in the Heart,7.4,1984,1h 51m,Robert Benton,Drama,Charles Fuller,"Howard E. Rollins Jr., Adolph Caesar, David Alan Grier, Art Evans, Denzel Washington",False
271,Tender Mercies,7.3,1983,1h 32m,Bruce Beresford,"Drama, Musical",Horton Foote,"Robert Duvall, Tess Harper, Betty Buckley, Michael Pataki, Ellen Barkin",True
272,Terms of Endearment,7.4,1983,2h 12m,James L. Brooks,"Comédia, Drama",James L. Brooks,"Shirley MacLaine, Debra Winger, Jack Nicholson, Danny DeVito, Jeff Daniels",True
273,The Right Stuff,7.8,1983,3h 13m,Philip Kaufman,"Aventura, Biografia, Drama, História",James L. Brooks,"Shirley MacLaine, Debra Winger, Jack Nicholson, Danny DeVito, Jeff Daniels",True
274,The Big Chill,7.1,1983,1h 45m,Lawrence Kasdan,"Comédia, Drama",Ronald Harwood,"Albert Finney, Tom Courtenay, Zena Walker, Eileen Atkins, Michael Bryant",False
275,The Dresser,7.4,1983,1h 58m,Peter Yates,Drama,Lawrence Kasdan,"Tom Berenger, Glenn Close, Jeff Goldblum, William Hurt, Kevin Kline",False
